2019407273,ted.europa.eu/udl?uri=TED:NOTICE:407273-2019:TEXT:EN:HTML,2019,3,27-AUG-19,R209.S3,0,0,N,Stadt Wien - Unternehmung Wiener Krankenanstaltenverbund („KAV“),9110024220375,Thomas-Klestil-Platz 7/1,Wien,1030,A2   ,AT,AT,N,,8,,Health,N,N,N,S,AT13,N,,N,N,71314100,71314,1,45311200,N,1,6,4545177.01,4545177.01,4545177.01,N,OPE,,0,M,80 Punkte,Schlüsselperson Facharbeiter---Verzicht auf die Indexanpassung,10 Punkte---10 Punkte,N,6,10747465,1,,N,N,EAI Elektro Anlagenüberprüfung und Installationstechnik GmbH,,Mooswiesengasse 26,Wien,1140,AT,Y,1,Krankenhaus Hietzing mit Neurologischem Zentrum Rosenhügel („KHR“),8,,,,,,521380.45,521380.45,Y,28-JUN-19
2020109176,ted.europa.eu/udl?uri=TED:NOTICE:109176-2020:TEXT:EN:HTML,2020,3,03-MAR-20,R209.S3,0,0,N,Arbeitsmarktservice Kärnten,9110008201062,Rudolfsbahngürtel 42,Klagenfurt,9021,A2   ,AT,AT,N,,6,,Social protection,N,N,N,S,AT21,N,,N,N,80400000,80400,,,N,4,1,172781.48,172781.48,172781.48,N,NOC,,0,M,30,Ausstattung---Frauenförderung---Konzept---Personal,15---5---15---35,N,1,11304979,,,N,N,WIFI Kärnten GmbH,9110016493633,,Klagenfurt,,AT,N,,,1,,,,,,172781.48,172781.48,N,27-JAN-20
2021167501,ted.europa.eu/udl?uri=TED:NOTICE:167501-2021:TEXT:EN:HTML,2021,3,30-MAR-21,R209.S4,0,0,N,Autobahnen- und Schnellstraßen-Finanzierungs-Aktiengesellschaft,,Rotenturmstraße 5-9,Wien,1030,,AT,,N,,6,,Other,N,N,N,S,AT,N,,N,N,71000000,,,,Y,,1,968215,968215,968215,N,OPE,,0,M,50,Qualität,50,N,1,12761921,,,N,Y,"Bietergemeinschaft Zieritz & Partner ZT GmbH, St. Pölten Ingenieurbüro ste.p ZT-GmbH, Zentrale GDP ZT GmbH, GDP ZT GmbH, Graz",,,St. Pölten,3100,AT,N,302100817,"Planungsleistung GESB Schmittenhäusl – ASt Thalgau A01 West Autobahn AB Km 267,0 – 274,3, Planungsleistung Instandsetzung Brücken, Oberbauerneuerung Straße und Erneuerung Entwässerung",3,,,,,,968215,968215,Y,16-MAR-21
20216786,ted.europa.eu/udl?uri=TED:NOTICE:6786-2021:TEXT:EN:HTML,2021,3,05-JAN-21,R209.S3,0,0,N,Landeskrankenanstalten-Betriebsgesellschaft — KABEG,,Krassniggstrasse 15,Klagenfurt am Wörthersee,9020,,AT,,N,,8,,Health,N,N,N,S,AT21,N,,N,N,79713000,,1,79710000---79714000---71317200,N,,1,1001838,1001838,1001838,N,OPE,,0,M,70.00,"Personalausbildung, Zertifikate---Reaktionszeit erw. Einsatzpersonal",10.00---20.00,N,1,12385196,1,,N,N,G4S Secure Solutions AG,,August Jaksch Straße 2,Klagenfurt,9020,AT,N,,Klinikum Klagenfurt,2,,,,2,1000000,1001838,1001838,N,05-JAN-21
2021205704,ted.europa.eu/udl?uri=TED:NOTICE:205704-2021:TEXT:EN:HTML,2021,3,21-APR-21,R209.S4,0,0,N,Vorarlberger Krankenhaus-Betriebsges. m. b. H,,Carinagasse 41,Feldkirch,6800,,AT,,N,,6,,Health,N,N,N,U,AT34,N,,N,N,33141200,,4,33141200,N,,6,666386,666386,666386,N,OPE,,0,M,60.00,Nutzerbewertung,40.00,N,6,12856069,4,,N,N,R. Heintel GesmbH,,Erdbergstraße 166,Wien,1030,AT,Y,,Auffang- und Messsysteme,1,1,,,1,,266675,266675,N,12-APR-21
2021318955,ted.europa.eu/udl?uri=TED:NOTICE:318955-2021:TEXT:EN:HTML,2021,3,21-JUN-21,R209.S4,0,0,N,Oö. Theater und Orchester GmbH,,Promenade 39,Linz,4020,,AT,,N,,6,,"Recreation, culture and religion",N,N,N,U,AT31,N,,N,N,31500000,,2,31524000---31527000---31518600,N,,3,296688.22,296688.22,296688.22,N,OPE,,0,M,88,Gewährleistungsverlängerung---Verkürzung der Lieferzeit---kurzfristige Bereitstellung eines Ersatzscheinwerfers im Störungsfall,5---2---5,N,3,13086801,2,,N,N,Signal Sound & Light GmbH,9110017173336,"Flossländ, 22",Knittelfeld,8720,AT,Y,,Kopfbewegte LED-Profilscheinwerfer für die Spielstätte Schauspielhaus für den Vorbühnenbereich (Vorderlicht),1,,,,,,50436.12,50436.12,N,25-MAY-21
2022597518,ted.europa.eu/udl?uri=TED:NOTICE:597518-2022:TEXT:EN:HTML,2022,3,24-OCT-22,R209.S5,0,0,N,Stadtgemeinde Bruck an der Mur,,Koloman-Wallisch-Platz 1,Bruck an der Mur,8600,,AT,,N,,3,,General public\services,N,N,N,S,AT,N,,N,N,85312110,,,85312110,N,,1,3200000,3200000,3200000,N,NIC,,0,M,60,Konzept---Qualität Personal - Fachgespräch,25---15,N,1,15079768,,,N,N,Volkshilfe Steiermark Gemeinnützige Betriebs GmbH,9110016288673,Sackstraße 20/1,Graz,8010,AT,N,ThN-21/77,Betriebsführung für die Kinderkrippe LKH Hochsteiermark und Schülerhort Grabenfeldstraße,1,,,,,3200000,3200000,3200000,N,29-SEP-22
2021210431,ted.europa.eu/udl?uri=TED:NOTICE:210431-2021:TEXT:EN:HTML,2021,3,23-APR-21,R209.S4,0,0,N,Magistrat der Stadt Wien — Magistratsabteilung 28,9110020115842,Lienfeldergasse 96,Wien,1170 Wien,,AT,,N,,3,,General public\services,N,N,N,W,AT130,N,,N,N,45000000,,8,45000000,Y,,9,20550665.72,20550665.72,20550665.72,N,OPE,,0,M,950,Verkürzung der Leistungsfrist,50,N,9,12868141,8,,N,N,STRAMARK Verkehrstechnik GmbH,9110016502984,Weissenbach 9,Hinterbrühl,2371,AT,Y,MA28-B-O-366102/2020,"Straßenbau: Verkehrszeichenaufstellung und Schlosserarbeiten in Wien (Rahmenvertrag) im 6., 7. und 8. Bezirk",6,5,,,6,1277781.62,1277781.62,1277781.62,N,19-APR-21
2021297626,ted.europa.eu/udl?uri=TED:NOTICE:297626-2021:TEXT:EN:HTML,2021,3,09-JUN-21,R209.S4,0,0,N,Stadt Wien – Wiener Wohnen,,Rosa-Fischer-Gasse 2,Wien,1030,,AT,,N,,3,,Housing and community amenities,N,N,N,S,AT130,N,,N,N,50530000,,1,50530000,Y,,2,23144718.86,23144718.86,23144718.86,N,OPE,,0,L,,,,N,2,13046090,1,,N,N,W. Jessernig Gesellschaft m.b.H.,9110015551211,Leberstraße 20,Wien,1110,AT,Y,1,"Miete, Wartung, Reparatur, Lieferung und Anschluss von elektrisch- und gasbeheizten Waschgeräten sowie Lieferung von Waschküchenzubehör",2,,,,2,,12074409.46,12074409.46,N,28-MAY-21
2021427714,ted.europa.eu/udl?uri=TED:NOTICE:427714-2021:TEXT:EN:HTML,2021,6,18-AUG-21,R209.S4,0,0,N,ÖBB-Infrastruktur AG,,Praterstern 3,Wien,1020,,AT,,N,,4,,Railway services,N,N,N,U,AT,N,,N,N,34941800,,,34946220,N,,1,507005.26,507005.26,507005.26,N,NIC,,0,L,,,,N,1,13335199,,,N,N,Weichenwerk Wörth GmbH,,,St. Georgen am Steinfelde,,AT,Y,1,Doppelte Kreuzungsweichen Form 54E2,1,1,,,,,507005.26,507005.26,N,18-AUG-21
2020463725,ted.europa.eu/udl?uri=TED:NOTICE:463725-2020:TEXT:EN:HTML,2020,3,28-SEP-20,R209.S3,0,0,N,"Die Republik Österreich (Bund), die Bundesbeschaffung GmbH und die Bundesimmobiliengesellschaft m.b.H.",210220y,Lassallestraße 9b,Wien,1020,A1   ,AT,AT,N,,8,,Other,Y,N,Y,S,AT13,Y,K,Y,N,90910000,90910,7,90910000,Y,1,30,140896200,140896200,140896200,N,OPE,,0,M,"55,00",Abgeschlossene Ausbildung Objektleiter---Arbeitssicherheits- und Gesundheitsschutz-managementsystem---Ausbildung Objektauditor---Umweltmanagementsystem---Zusätzliche Ausbildung Objektleiter---elektronischer Zusatzleistungsnachweis durch den Auftragnehmer,"15,00---5,00---5,00---5,00---10,00---5,00",N,30,12002204,7,,N,N,ISS Facility Services GmbH,095993t,Brünner Straße 85,Wien,1210,AT,N,7.1,Teillos 7 Wien,15,6,0,0,15,,5372500,5372500,N,10-DEC-19
2019457173,ted.europa.eu/udl?uri=TED:NOTICE:457173-2019:TEXT:EN:HTML,2019,3,27-SEP-19,R209.S3,0,0,N,Medizinische Universität Graz,9110002391394,Auenbruggerplatz 2,Graz,8036,A2   ,AT,AT,N,,8,,Education,N,N,N,U,AT221,N,,N,N,33100000,33100,,33190000---33696000---38000000---33100000,Y,1,1,538923.63,538923.63,538923.63,N,OPE,,0,M,136,Anpassbarkeit der Färbeprotokolle---Anzahl der parallel in einem Lauf anwendbaren Primärantikörper---Ausfallzeit durch Routinewartungen---DAB soll im geschlossenen System angewandt werden---Dauer durchschnittliche tägliche Benutzerwartung---Ersatzleistung an Reagenzien---Flexibilität beim Detektionssystem---Geräte intern/automatisiert---Gerätelautstärke---Hands-on-time---Kapazität/Workflow---Lieferzeiten von Reagenzien---Primärantikörper im Portfolio des Anbieters---Reagenzien-Kontrollsysteme---Reaktionszeit bei Störungsmeldungen---Wartungs- und Reparaturkosten im Pauschalpreis pro Inkubation enthalten---Weiterverwendung von im Labor bereits etablierten Primärantikörpern---Zusätzliche in-situ-Hybridisierungs Inkubationen---durchschnittliches Abfallvolumen pro Lauf---garantierte Lieferzeit Geräte,3---10---10---20---10---10---6---10---5---5---40---5---20---10---10---20---20---20---5---20,N,1,10816638,,,N,N,Agilent Technologies Österreich GmbH,0,Mooslackengasse 17,Wien,1190,AT,N,,,2,,,,,,538923.63,538923.63,Y,29-AUG-19
2019176031,ted.europa.eu/udl?uri=TED:NOTICE:176031-2019:TEXT:EN:HTML,2019,3,11-APR-19,R209.S3,0,0,N,Autobahnen- und Schnellstraßen-Finanzierungs-Aktiengesellschaft,,Rotenturmstraße 5-9,Wien,1011,A2   ,AT,AT,N,,6,,Other,N,N,N,S,AT312,N,,N,N,71320000,71320,,,Y,1,1,274730,274730,274730,N,OPE,,0,M,50 %,Qualität,50 %,N,1,10418472,,,N,N,ZKP ZT GmbH Zivilingenieure für Bauwesen,,,Nötsch i. G. 120,9611,AT,N,301901153,"A25 Welser Autobahn, INSB ÖBB Terminal bis Kn.Wels, Planung Straße/Brücke/Lärmschutz",6,,,,,,274730,274730,Y,09-APR-19
202063329,ted.europa.eu/udl?uri=TED:NOTICE:63329-2020:TEXT:EN:HTML,2020,3,04-FEB-20,R209.S3,0,0,N,International Centre for Migration Policy Development (ICMPD),,,Vienna,1010,A2   ,AT,AT,N,,5A,,Other,N,N,N,U,00,N,,N,N,32344210,32344,2,32344210---31711423,Y,1,4,2142191.15,2142191.15,2142191.15,Y,OPE,,0,L,,,,N,4,11230677,2,,N,N,NETCOM Technologies,,,Casablanca,,MA,N,1200151,DMR and P25 Radios with Accessories,5,,,,,,62191.45,62191.45,N,
202044889,ted.europa.eu/udl?uri=TED:NOTICE:44889-2020:TEXT:EN:HTML,2020,3,28-JAN-20,R209.S3,0,0,N,Oesterreichische Nationalbank – Abteilung EGS,91100001123637,Otto-Wagner-Platz 3,Wien,1090,A2   ,AT,AT,N,,8,,General public\services,N,N,N,S,AT,N,,N,N,72700000,72700,,,N,1,1,954213.41,954213.41,954213.41,N,RES,,0,M,"80,00",praktische Qualifikationen der Arbeitskräfte---verfügbare CCIEs,"10,00---10,00",N,1,11192108,,,N,N,Kapsch BusinessCom AG – Wien,FN 178368 g,Wienerbergstraße 53,Wien,1120,AT,N,1,"Wartung Netzwerkkomponenten (Cisco) und Firewallkomponenten (Cisco, Palo Alto)",2,0,,,2,,954213.41,954213.41,N,28-JAN-20
201984681,ted.europa.eu/udl?uri=TED:NOTICE:84681-2019:TEXT:EN:HTML,2019,3,19-FEB-19,R209.S3,0,0,N,Bundesimmobiliengesellschaft m. b. H.,0,Trabrennstraße 2c,Wien,1020,A2   ,AT,AT,N,,8,,Other,N,N,N,W,AT130,N,,N,N,45315100,45315,,,N,4,1,12579755,891460.59,891460.59,N,OPE,,0,M,85 %,Schlüsselperson Bauleiter---Schlüsselperson Polier---verlängerte Gewährleistung,5 %---5 %---5 %,N,1,10301880,,,N,N,emc elektromanagement & construction gmbh,9110015482539,Betriebsstraße 15,Böheimkirchen,3071,AT,Y,4600224586,,10,8,,,10,,891460.59,891460.59,N,18-FEB-19
2018149454,ted.europa.eu/udl?uri=TED:NOTICE:149454-2018:TEXT:EN:HTML,2018,3,05-APR-18,R209.S2,0,0,N,"Landeshauptstadt Wien, vertreten durch den Wiener Krankenanstaltenverbund",AT,Lassallestraße 9b,Wien,1020,A2   ,AT,AT,N,,6,,Health,N,N,N,S,AT13,Y,A,Y,N,90910000,90910,1,90910000,Y,1,3,58777700,58777700,58777700,N,NIC,,0,M,55,Qualität,45,N,7,8642551,1,,N,N,JANUS Gruppe GmbH,AT,Goldschlagstraße 23,Wien,1150,AT,N,01,Reinigungsdienstleistungen KAV 2017 Los 1,5,0,,,,,1345500,1345500,N,15-MAY-17
2019572156,ted.europa.eu/udl?uri=TED:NOTICE:572156-2019:TEXT:EN:HTML,2019,3,29-NOV-19,R209.S3,0,0,N,Asfinag Bau Management GmbH,,Modecenterstraße 16; 3. Stock Bau Ost,Wien,1030,A2   ,AT,AT,N,,6,,Other,N,N,N,S,AT,N,,N,N,71700000,71700,,,Y,1,1,490860,490860,490860,Y,OPE,,0,M,50,Qualität,50,N,1,11003069,,,N,N,Beitl ZT GmbH,,,Wien,,AT,Y,301402290,Ökologische Bauaufsicht,4,,,,,,490860,490860,Y,26-JAN-15
2022430450,ted.europa.eu/udl?uri=TED:NOTICE:430450-2022:TEXT:EN:HTML,2022,6,01-AUG-22,R209.S5,0,0,N,ÖBB-Infrastruktur AG,,Rebhanngasse 14,Wien,1200,,AT,,N,,4,,Railway services,N,N,N,W,AT12,N,,N,N,45232000,,,,N,,1,990453.18,990453.18,990453.18,N,NIC,,0,L,,,,N,1,14729512,,,N,N,Leyrer + Graf Baugesellschaft m.b.H.,,Conrathstraße 6,Gmünd,3950,AT,Y,,,9,,,,,,990453.18,990453.18,N,30-JUL-22
2018407445,ted.europa.eu/udl?uri=TED:NOTICE:407445-2018:TEXT:EN:HTML,2018,3,18-SEP-18,R209.S3,0,0,N,Schloß Schönbrunn Kultur- u. Betriebsg.m.b.H,,Schönbrunner Schloßstraße 47,Wien,1130,A2   ,AT,AT,N,,6,,"Recreation, culture and religion",N,N,N,W,AT,N,,N,N,45223210,45223,,45223210,N,4,1,1247342.49,1247342.49,1247342.49,N,OPE,,0,M,,Preis---Verlängerung Gewährleistung,90---10,N,1,8964112,,,N,N,Hess Stahlbau & Montage GmbH,,Matzelsdorf 70,Neumarkt,4212,AT,N,,Arrival Center Schönbrunn – Stahl- und Metallbau arbeiten,4,,,,,,1247342.49,1247342.49,N,20-AUG-18
2022441635,ted.europa.eu/udl?uri=TED:NOTICE:441635-2022:TEXT:EN:HTML,2022,3,08-AUG-22,R209.S5,0,0,N,Bundesministerium für Inneres,,Hohenbergstraße 1b,Wien,1120,,AT,,N,,1,,General public\services,N,N,N,U,AT,N,,N,N,18220000,,,,Y,,1,181043,181043,181043,N,OPE,,0,L,,,,N,1,14750302,,,N,N,Les Sports-Textilhandelsgesellschaft m.b.H.,0,Kärntnerstraße 28,Innsbruck,6020,AT,Y,,,1,1,,,,,181043,181043,N,02-AUG-22
2020427096,ted.europa.eu/udl?uri=TED:NOTICE:427096-2020:TEXT:EN:HTML,2020,3,07-SEP-20,R209.S3,0,0,N,Autobahnen- und Schnellstraßen-Finanzierungs-AG,,"z.H. ASFINAG Bau Management GmbH, Modecenterstraße 16",Wien,1030,A2   ,AT,AT,N,,6,,Other,N,N,N,S,AT,N,,N,N,71000000,71000,Los C,71000000,Y,1,6,966477.31,966477.31,966477.31,N,OPE,,0,M,50 %,Qualität,50 %,N,6,11938633,100,,N,N,Kratzer & Partner ZT GmbH,,,Graz,,AT,Y,502000492,Tunnelkontrollen; Tunnelscan; Tunnelprüfungen 2020 im Bereich der Bau Management GmbH bauliches Erhaltungsmanagement Süd Los C – Bosrucktunnel,3,,,,,,43670,43670,Y,04-AUG-20
2019553931,ted.europa.eu/udl?uri=TED:NOTICE:553931-2019:TEXT:EN:HTML,2019,3,20-NOV-19,R209.S3,0,0,N,Freiwillige Feuerwehr Perchtoldsdorf,,Donauwörther Straße 29 z. H. Kommando,Perchtoldsdorf,2380,A2   ,AT,AT,N,,8,,Other,N,N,N,U,AT127,N,,N,N,34144211,34144,,34144211,N,1,1,1,1,1,N,OPE,,0,L,,,,N,1,10970969,,,N,N,Rosenbauer Österreich,,,Leondig,4060,AT,N,,,1,,,,,,1,1,N,20-NOV-19
2022673304,ted.europa.eu/udl?uri=TED:NOTICE:673304-2022:TEXT:EN:HTML,2022,3,29-NOV-22,R209.S5,0,0,N,Universität Innsbruck,,Innrain 52,Innsbruck,6020,,AT,,N,,6,,Education,N,N,N,U,AT332,N,,N,N,32321200,,,,Y,,1,7480,7480,7480,N,OPE,,0,M,85.00,Erhalt eines Notbetriebs---Verlängerung des Gewährleistungszeitraums,10.00---5.00,N,1,15255964,,,N,N,City Videopool Spitzenstätter KG,,Egerdachstraße 11,Innsbruck,6020,AT,Y,1,Beschaffung und Lieferung von 4 Stück Dokumentenkameras für Hörsäle der Universität Innsbruck (Los 3),1,1,,,1,,7480,7480,N,29-NOV-22
202292715,ted.europa.eu/udl?uri=TED:NOTICE:92715-2022:TEXT:EN:HTML,2022,3,16-FEB-22,R209.S5,0,0,N,Bundesministerium für Inneres,,Herrengasse 7,Wien,1010,,AT,,N,,1,,General public\services,N,N,N,U,AT,N,,N,N,18220000,,2,18220000,Y,,2,141856,141856,141856,N,OPE,,0,L,,,,N,2,14071341,2,,N,N,Les Sports Textilhandelsgesellschaft m.b.H.,9110015307665,Kärntnerstraße 28,Innsbruck,6020,AT,Y,2,Alpinwesten Sommer,1,1,,,,71280,71280,71280,N,10-FEB-22
2019410563,ted.europa.eu/udl?uri=TED:NOTICE:410563-2019:TEXT:EN:HTML,2019,3,28-AUG-19,R209.S3,0,0,N,Landeskrankenanstalten-Betriebsgesellschaft - KABEG,,Krassniggstrasse 15,Klagenfurt am Wörthersee,9020,A2   ,AT,AT,N,,6,,Health,N,N,N,U,AT21,N,,N,N,15100000,15100,21,15100000,Y,1,56,453257,453259,453259,N,OPE,,0,M,50.00,Qualität,50.00,N,56,10752151,21,,N,N,Karnerta GmbH,,Südring 334,Klagenfurt,9020,AT,N,,LOS: Rindfleisch - Schnitzel 120 g,5,3,,,5,,4670,4670,N,07-AUG-19
2019183170,ted.europa.eu/udl?uri=TED:NOTICE:183170-2019:TEXT:EN:HTML,2019,3,15-APR-19,R209.S3,0,0,N,SVD Büromanagement GmbH,,Dresdner Straße 45,Wien,1200,A2   ,AT,AT,N,,8,,Other,N,N,N,U,AT,N,,N,N,32552100,32552,,,Y,1,1,579844,579844,579844,N,NIC,,0,L,,,,N,1,10427640,,,N,N,NTS Netzwerk Telekom Service AG,,Parkring 4,Grambach bei Graz,8074,AT,N,,,2,,,,2,,579844,579844,N,09-APR-19
2018515138,ted.europa.eu/udl?uri=TED:NOTICE:515138-2018:TEXT:EN:HTML,2018,3,19-NOV-18,R209.S3,0,0,N,Verkehrsverbund Tirol GesmbH,,Sterzinger Straße 3,Innsbruck,6020,A3   ,AT,AT,N,,8,,Other,N,N,N,S,AT331,N,,N,N,60112000,60112,2,60112000---60000000---60100000,N,1,3,8740553.64,8740553.64,8740553.64,N,NIC,,0,M,600,Ersatzgestellung---Maßnahmen zur Wahrnehmung regionaler Verantwortung bei der Leistungserbringung,200---200,N,3,9099182,2,,N,N,ÖBB-Postbus GmbH,,,Wien,,AT,N,"""Regiobus Lechtal"" (Vergabe-Nr. 2017 01 02)","Abschluss eines Verkehrsdienstvertrages über den Betrieb eines Kraftfahrlinienverkehrs (Betriebsbeginn: Dezember 2018) der Linien 110, 111; 199",4,3,1,,,,1930587.48,1930587.48,Y,29-OCT-18
2020104538,ted.europa.eu/udl?uri=TED:NOTICE:104538-2020:TEXT:EN:HTML,2020,3,27-FEB-20,R209.S3,0,0,N,GBG GmbH,9110015965827,Conrad von Hötzendorfstr. 94,Graz,8010,A2   ,AT,AT,N,,8,,Other,N,N,N,S,AT221,Y,K,Y,N,65310000,65310,10,65310000,N,3,10,3981208.49,547.01,547.01,N,OPE,,0,M,50,Werbe-Paket,50,N,10,11296528,10,,N,N,Elektrizitätswerk Gösting Stromversorgungs GmbH,9110016658797,Viktor-Franz-Straße 15,Graz,8051,AT,Y,,Theater Holding,2,1,,,2,,61.09,61.09,N,09-JUL-19
2021520439,ted.europa.eu/udl?uri=TED:NOTICE:520439-2021:TEXT:EN:HTML,2021,6,08-OCT-21,R209.S4,0,0,N,ÖBB Personenverkehr AG,,Am Hauptbahnhof 2,Wien,1100,,AT,,N,,4,,Railway services,N,N,N,U,AT1,N,,N,N,31440000,,,,N,,1,625100,625100,625100,N,NIC,,0,M,80%,"Lieferzeit, Gewährleistungsfirst",20%,N,1,13523437,,,Y,,Statron GmbH,,Gewerbepark 11,Grafenschachen ,7423,AT,Y,303/4600029602,Herstellung und Lieferung von Ni-Cd-Batterien für Loks und Triebfahrzeuge,,,,,,,,,N,12-MAY-21
2021666685,ted.europa.eu/udl?uri=TED:NOTICE:666685-2021:TEXT:EN:HTML,2021,3,22-DEC-21,R209.S5,0,0,N,Stadt Graz,,Schmiedgasse 26,Graz,8010,,AT,,N,,3,,Social protection,N,N,N,U,AT221,Y,A,Y,N,15000000,,18,15000000,N,,23,1961300,1924000,1924000,N,OPE,,0,M,Rahmenvereinbarung,"Fleischprodukte dürfen nur frisch geliefert werden---Gewicht, Menge der bestellten Waren sind genau einzuhalten, bei über 5 % Differenzwird Ware nicht angenommen bzw. der Überschuss nicht bezahlt---Nachweis über ein eingeführtes Eigenkontrollsystem nach den Grundsätzen vonHACCP; insbesondere 2-4°C ist die Kühlkette nachweislich zu dokumentieren und auf Verlangen Einsicht zugewähren---Ware muss küchenfertig geliefert werden",Ausschlussgrund---Ausschlussgrund---Ausschlussgrund---Ausschlussgrund,N,54,13823016,18,,N,N,Qualitätsfleischerei Feiertag GmbH,9110023988795,Dr.-Karl-Renner-Gasse 12,Weiz,8160,AT,Y,41,Schwein,4,,,,,40000,28000,28000,N,20-DEC-21
20184477,ted.europa.eu/udl?uri=TED:NOTICE:4477-2018:TEXT:EN:HTML,2018,3,04-JAN-18,R209.S2,0,0,N,Stadt Wien – Wiener Wohnen,0,Rosa-Fischer-Gasse 2,Wien,1030,A2   ,AT,AT,N,,3,,Housing and community amenities,N,N,N,W,AT130,N,,N,N,45261210,45261,,45211100,Y,4,1,1238200.43,1238200.43,1238200.43,N,OPE,,0,M,95 %,Verlängerung der Gewährleistungsfrist,5 %,N,1,8453995,,,N,N,Gottfried Jecho Gesellschaft m.b.H.,,Gaindorf 148,Ravelsbach,3720,AT,Y,1,"14, Hackinger Straße 30-36",10,,,,,,1238200.43,1238200.43,N,03-JAN-18
2020201513,ted.europa.eu/udl?uri=TED:NOTICE:201513-2020:TEXT:EN:HTML,2020,3,28-APR-20,R209.S3,0,0,N,Vorarlberger Krankenhaus-Betriebsgesellschaft mit beschränkter Haftung,9110015396560,Carinagasse 41,Feldkirch,6800,A2   ,AT,AT,N,,8,,Health,N,N,N,U,AT342,N,,N,N,18142000,18142,3,18142000,Y,1,16,4890550,4890550,4890550,N,NOC,,0,L,,,,N,16,11469645,3,,N,N,BayWa Vorarlberg HandelsGmbH,9110015771145,Scheibenstraße 2,Lauterach,6923,AT,N,4501211321,"Schutzmasken, FFP2, 4501211321",1,,,,,37500,37500,37500,N,19-MAR-20
2021346013,ted.europa.eu/udl?uri=TED:NOTICE:346013-2021:TEXT:EN:HTML,2021,3,06-JUL-21,R209.S4,0,0,N,Universität Innsbruck,,Innrain 52,Innsbruck,6020,,AT,,N,,6,,Education,N,N,N,U,AT332,N,,N,N,42513200,,,,Y,,1,139246.4,139246.4,139246.4,N,OPE,,0,M,65.00,Dauer der Verlängerung des Gewährleistungszeitraums---Dauer der Verlängerung des Nachschaffungszeitraums---Reaktionszeitraum (nach Ablauf des Gewährleistungszeitraums)---Reaktionszeitraum (während des Gewährleistungszeitraums)---Stundensatz für den fachlich qualifizierten und entsprechend ausgebildeten Mitarbeiter für Reparaturleistungen---Wartung der Kühlanlage während des Gesamt-Gewährleistungszeitraums,5.00---5.00---5.00---5.00---5.00---10.00,N,1,13138583,,,N,N,Nordlicht Kühlung Klumaier GmbH,,Dr. Körner Strasse 17,Schwaz,6130,AT,Y,1,"Beschaffung einer Kühlanlage für eine Produktionsküche für Gemeinschaftsverpflegung im Gebäude Innrain 52 a, 6020 Innsbruck",2,2,,,2,,139246.4,139246.4,N,06-JUL-21
201943766,ted.europa.eu/udl?uri=TED:NOTICE:43766-2019:TEXT:EN:HTML,2019,3,24-JAN-19,R209.S3,0,0,N,ASFiNAG BMG,,Modecenterstraße 16,Wien,1030,A2   ,AT,AT,N,,6,,Other,N,N,N,S,AT,N,C,Y,N,71000000,71000,9,71000000,N,1,9,2940970.17,2940970.17,2940970.17,N,OPE,,0,L,,,,N,9,10242227,9,,N,N,Nievelt Labor GmbH,,,Stockerau,,AT,N,,Abnahmeprüfung,4,,,,,,678323.67,678323.67,N,29-MAR-16
2021111112,ted.europa.eu/udl?uri=TED:NOTICE:111112-2021:TEXT:EN:HTML,2021,3,02-MAR-21,R209.S4,0,0,N,Bundesministerium für Inneres,9110006619920,Herrengasse 7,Wien,1010,,AT,,N,,1,,General public\services,N,N,N,U,AT,N,,N,N,35330000,,2,35330000,Y,,2,21089405,21089405,21089405,N,OPE,,0,L,,,,N,2,12643924,2,,N,N,Sellier & Bellot a. s.,0,Lidicka 667,Vlasim,25801,CZ,N,2,"Patrone 223 Rem. schadstoffreduziert mit 3,6 g Weichkerngeschoß",3,,,,3,,6710660,6710660,N,22-FEB-21
2020349375,ted.europa.eu/udl?uri=TED:NOTICE:349375-2020:TEXT:EN:HTML,2020,3,23-JUL-20,R209.S3,0,0,N,Oberösterreichische Gesundheitsholding GmbH,,"Vergabezentrum, Goethestraße 89",Linz an der Donau,4020,A2   ,AT,AT,N,,6,,Health,N,N,N,U,AT31,N,,N,N,33140000,33140,,,N,1,1,387500,387500,387500,N,NOC,,0,M,0,Verfügbarkeit,100,N,1,11776995,,,N,N,Premium GmbH,,Frühlingstraße 3,Traunstein,83728,DE,Y,,,1,1,,,,,387500,387500,N,26-MAR-20
2020488377,ted.europa.eu/udl?uri=TED:NOTICE:488377-2020:TEXT:EN:HTML,2020,3,12-OCT-20,R209.S3,0,0,N,Amt der Burgenländischen Landesregierung,0,Europaplatz 1,Eisenstadt,7000,A2   ,AT,AT,N,,1,,General public\services,N,N,N,U,AT11,N,,N,N,30211100,30211,,72263000,N,1,1,272614,272614,272614,N,OPE,,0,L,,,,N,1,12048300,,,N,N,Jenoptik Robot GmbH,9110016485751,Perfektastraße 61/7/1,Wien,1230,AT,N,A5/8.702-10000,Geschwingkeitsmessgeräte,3,,,,3,500000,272614,272614,N,14-JUL-20
202097763,ted.europa.eu/udl?uri=TED:NOTICE:97763-2020:TEXT:EN:HTML,2020,6,25-FEB-20,R209.S3,0,0,N,ÖBB-Infrastruktur AG,,Nordbahnstraße 50,Wien,1020,A3   ,AT,AT,N,,4,,Railway services,N,N,N,U,AT,N,,N,N,31321700,31321,10,31321700,N,1,18,8460827.97,8460827.97,8460827.97,N,NIC,,0,L,,,,N,3,11285585,"9, 10, 11",,N,N,Schwechater Kabelwerke Gesellschaft m. b. H.,,Himberger Straße 50,Schwechat,2320,AT,Y,,,5,4,1,,5,,65447.89,65447.89,N,25-FEB-20
202111782,ted.europa.eu/udl?uri=TED:NOTICE:11782-2021:TEXT:EN:HTML,2021,3,07-JAN-21,R209.S3,0,0,Y,Gemeindeverband Abwasserbeseitigung Pöchlarn & Stadtgemeinde Melk---Stadtgemeinde Melk,9110003264925---9110004426643,Wörth 7---Rathausstraße 11,Pöchlarn---Melk,3380---3390,,AT,,N,,3,,General public\services,Y,Y,N,S,AT12,N,,N,N,71322000,,,71520000,Y,,1,888300,888300,888300,N,NIC,,0,M,40,Ausarbeitung „Ausbau- und Anpassungskonzept“---Präsentation der Schlüsselpersonen---Reaktionszeit des Projektleiters-Örtliche Bauaufsicht,30---15---15,N,1,12401334,,,N,N,Büro Dr. Lengyel ZT GmbH,9110015805215,Rennweg 46-50/1/2,Wien,1030,AT,Y,1,Generalplanungsleistungen samt (Fach-)Bauaufsicht für die Sanierung/Erweiterung der ARA Pöchlarn und der ARA Melk,4,4,,,4,,888300,888300,Y,30-DEC-20
202159234,ted.europa.eu/udl?uri=TED:NOTICE:59234-2021:TEXT:EN:HTML,2021,3,01-FEB-21,R209.S3,0,0,N,Österreichische Gesundheitskasse,,Haidingergasse 1,Wien,1030,,AT,,N,,6,,Health,N,N,N,U,AT34,N,A,N,N,33140000,,60,33141110,N,,74,8563761,3846746,3846746,N,OPE,,0,L,,,,N,125,12522572,60,,N,N,Lohmann & Rauscher GmbH,,Johann Schorsch Gasse 4,Wien,1140,AT,N,,Saugkompresse steril,2,,,,2,,12164,12164,N,05-JAN-21
202096675,ted.europa.eu/udl?uri=TED:NOTICE:96675-2020:TEXT:EN:HTML,2020,3,25-FEB-20,R209.S3,0,0,N,Verein Österreich Werbung,9110018585060,Vordere Zollamtsstraße 13,Wien,1030,A2   ,AT,AT,N,,6,,"Recreation, culture and religion",N,N,N,U,"AT,DE,ES",Y,,Y,N,39000000,39000,,,N,1,1,500000,499749.25,499749.25,N,NOC,,0,M,50 %,Bewertung der Qualität gemäß Pkt 23.3 der Ausschreibung,50 %,N,1,11283800,,,N,N,Mathias Rether – r2m Büro für Veranstaltungen,0,Wilhelmstraße 53,Diez,65582,DE,Y,,,1,1,1,,,500000,499749.25,499749.25,N,19-FEB-20
2020614814,ted.europa.eu/udl?uri=TED:NOTICE:614814-2020:TEXT:EN:HTML,2020,6,14-DEC-20,R209.S3,0,0,N,"ÖBB-Holding AG sowie für die mit ihr im Sinne des § 189a Z 8 UGB verbundenen Gesellschaften, alle vertretendurch die ÖBB-Infrastruktur",,Praterstern 3,Wien,1020,A3   ,AT,AT,N,,4,,Railway services,Y,N,Y,W,AT,N,,N,N,45311000,45311,,,N,4,1,989944.26,989944.26,989944.26,N,NIC,,0,,,,,N,1,12317172,,,Y,N,emc elektromanagement & construction GmbH,,,Böheimkirchen,3071,AT,N,,Errichtung und Adaptierung der elektrischen Anlagen im Zuge des Umbaus Bf. Lienz,8,3,,,8,,989944.26,989944.26,N,10-DEC-20
202258593,ted.europa.eu/udl?uri=TED:NOTICE:58593-2022:TEXT:EN:HTML,2022,3,28-JAN-22,R209.S5,0,0,N,Wiener Gesundheitsverbund – Serviceeinheit Einkauf (SEE),,"Guglgasse 17, 2. OG",Wien,1110,,AT,,N,,3,,Health,N,N,N,S,AT130,N,,N,N,72200000,,,,Y,,1,195195,195195,195195,N,NIC,,0,L,,,,N,1,14004593,,,N,N,ATOS IT Solutions and Services GmbH,9110017699812,Siemensstraße 92,Wien,1210,AT,N,,Erweiterung HCM STAFF Ablöse,1,,,,,,195195,195195,N,14-JAN-22
2020344604,ted.europa.eu/udl?uri=TED:NOTICE:344604-2020:TEXT:EN:HTML,2020,3,20-JUL-20,R209.S3,0,0,N,"Republik Österreich (Bund), die Bundesbeschaffung GmbH, sowie alle weiteren Auftraggeber im Sinne der §§ 4, 166 bis 168 BVergG 2018 im Bundesgebiet der Republik Österreich, im Vergabeverfahren alle vertreten durch die Bundesbeschaffung GmbH",210220y,Lassallestraße 9b,Wien,1020,A1   ,AT,AT,N,,8,,Other,Y,N,Y,U,AT,Y,K,Y,N,35113000,35113,,39500000---44611200,Y,1,1,420000000,420000000,420000000,N,OPE,Y,0,L,,,,N,47,11764336,,,N,N,Technomed GmbH,053058b,Stattegger Str. 31b,Graz,8045,AT,Y,24,Schutzmasken,116,105,54,7,116,420000000,420000000,420000000,N,14-JUL-20
