2021584782,ted.europa.eu/udl?uri=TED:NOTICE:584782-2021:TEXT:EN:HTML,2021,3,11-NOV-21,R209.S4,0,0,N,Azienda Ospedaliera S.Croce e Carle,,Corso Brunet 19 A,Cuneo,12100,,IT,,N,,8,,Health,N,N,N,U,ITC16,N,,N,N,33190000,,14,33190000,Y,,14,358980,357500,357500,N,OPE,,0,M,30,Qualità,70,N,14,13663730,14,,N,N,ABBOTT MEDICAL ITALIA S.r.l.,,,SESTO SAN GIOVANNI,,IT,N,14,CIG N. 8700292C13 ,2,,,,,79200,69000,69000,N,11-NOV-21
2021420011,ted.europa.eu/udl?uri=TED:NOTICE:420011-2021:TEXT:EN:HTML,2021,3,13-AUG-21,R209.S4,0,0,N,Estar - Ente di Supporto Tecnico Amministrativo,,Via di San Salvi n. 12,Firenze,50135,,IT,,N,,3,,Health,Y,N,Y,U,ITI1,N,,N,N,33100000,,,,N,,1,390000,390000,390000,N,OPE,,0,M,30,CRITERI QUALITATIVI COME INDICATO NEI DOCUMENTI DI GARA,70,N,1,13316660,,,N,N,AFERETICA SRL,,,BOLOGNA,,IT,Y,,Fornitura in service di UN SISTEMA DI PERFUSIONE RENALE IPOTERMICA E NORMOTERMICA E RELATIVO MATERIALE DI CONSUMO occorrente alle Aziende Sanitarie della Regione Toscana ,2,2,,,,,390000,390000,N,07-JUN-21
2019402611,ted.europa.eu/udl?uri=TED:NOTICE:402611-2019:TEXT:EN:HTML,2019,3,26-AUG-19,R209.S3,0,0,N,ASST Fatebenefratelli Sacco,,Via G.B. Grassi 74,Milano,20157,A2   ,IT,IT,N,,8,,Health,N,N,N,U,ITC4C,N,,N,N,33124110,33124,,,Y,1,1,622320.8,622320.8,622320.8,N,OPE,,0,M,30,Valutazione qualitativa (rif. art. 14 del Disciplinare di gara),70,N,1,10741281,,,N,N,Erreci S.r.l.,,,Pieve Emanuele,20090,IT,Y,,Fornitura in service di un sistema analitico per l’esecuzione di analisi quantitativa di aminoacidi in liquidi fisiologici occorrente all’UOC Screening neonatale e malattie metaboliche del P.O. Buzzi,1,,,,,,622320.8,622320.8,N,24-JUN-19
2019189714,ted.europa.eu/udl?uri=TED:NOTICE:189714-2019:TEXT:EN:HTML,2019,3,18-APR-19,R209.S3,0,0,N,Azienda USL di Bologna,,Via Castiglione 29,Bologna,40124,A2   ,IT,IT,N,,6,,Health,N,N,N,U,ITH5,Y,,Y,N,33190000,33190,22,33190000,Y,1,49,3891796.77,3891796.77,3891796.77,N,OPE,,0,M,30,Criteri indicati nella documentazione di gara,70,N,49,10436351,22,,N,N,M.G. LORENZATTO SPA,,,TO,,IT,N,,,6,,,,,,18559.2,18559.2,N,28-NOV-17
2020168606,ted.europa.eu/udl?uri=TED:NOTICE:168606-2020:TEXT:EN:HTML,2020,3,07-APR-20,R209.S3,0,0,N,Azienda ospedaliera San Camillo Forlanini,,circonvallazione Gianicolense 87,Roma,00152,A2   ,IT,IT,N,,3,,Health,N,N,N,U,IT,N,,N,N,33696500,33696,128,33696500,N,1,1,605042.9,598513.58,598513.58,N,OPE,,0,L,,,,N,128,11403647,128,,N,N,Aurogene,,,Roma,,IT,Y,,SONDA A SEQUENZA UNICA SPECIFICA PER IL RILEVAMENTO DI TRASLOCAZIONI BCL2 (18q21) Break Apart,5,4,,,,,696,696,N,24-MAR-20
2019169048,ted.europa.eu/udl?uri=TED:NOTICE:169048-2019:TEXT:EN:HTML,2019,6,05-APR-19,R209.S3,0,0,N,Brianzacque S.r.l.,,Viale E. Fermi 105,Monza,20900,A3   ,IT,IT,N,,4,,Water,N,N,N,S,"IT,ITC4,ITC4D",N,,N,N,71330000,71330,,,N,4,1,130869.36,70669.45,70669.45,N,OPE,,0,M,30,Caratteristiche metodologiche---Professionalità ed adeguatezza,30---40,N,1,10408665,,,N,N,Energard S.r.l.,,,Peschiera del Garda,,IT,Y,1,"Servizi tecnici di Direzione Lavori, in fase di realizzazione, dei lavori di installazione di un impianto di Cogenerazione ad alto rendimento della potenza di 1550 KWE + 1000 KWE connesso alla rete di TLR ed opere accessorie presso il Depuratore di Monza (MB)",4,,,,,,70669.45,70669.45,N,18-MAR-19
202263244,ted.europa.eu/udl?uri=TED:NOTICE:63244-2022:TEXT:EN:HTML,2022,3,01-FEB-22,R209.S5,0,0,N,A.O. ORDINE MAURIZIANO DI TORINO,,VIA MAGELLANO 1,TORINO,10128,,IT,,N,,8,,Health,N,N,N,S,ITC11,N,,N,N,85141200,,1,85141200,Y,,3,8740723.71,8740723.71,8740723.71,N,OPE,,0,M,20,QUALITA&apos;,80,N,3,14015291,1,,N,N,I.P.A.C. Infermieri Professionisti Associati Carmagnola di Patrizia Panfili & Soci ,,Via Baldessano 27,Carmagnola (TO),,IT,Y,1,LOTTO 1 - OSSERVAZIONE BREVE INTENSIVA E MECAU ,2,2,,,2,,4504475.35,4504475.35,N,29-DEC-21
2021463483,ted.europa.eu/udl?uri=TED:NOTICE:463483-2021:TEXT:EN:HTML,2021,3,09-SEP-21,R209.S4,0,0,N,"IRCCS Istituto Tumori ""Giovanni Paolo II"" di Bari",,"Viale Orazio Flacco, 65",Bari,70124,,IT,,N,,6,,Health,N,N,N,U,ITF47,N,,N,N,33198200,,1,33198200,N,,16,442656.89,442656.89,442656.89,N,OPE,,0,M,30,Qualità,70,N,16,13410951,1,,N,N,BS Medical srl,,,Reggio Emilia,,IT,N,,Lotto 1: CIG: 8580134FD0,1,,,,,,79348.5,79348.5,N,25-JUN-21
2022701964,ted.europa.eu/udl?uri=TED:NOTICE:701964-2022:TEXT:EN:HTML,2022,3,12-DEC-22,R209.S5,0,0,N,ARES Azienda Regionale della Salute Regione Sardegna,,Via Piero della Francesca 1,Selargius,09047,,IT,,N,,6,,Health,N,N,N,U,ITG2,N,A,Y,N,33196000,,42,33196000,N,,47,30137248.48,30137248.48,30137248.48,N,OPE,,0,L,,,,N,161,15313916,42,,N,N,Hollister Spa,,,Assago,,IT,N,1,Salviette rimozione  placca adesiva,4,,,,,,350102.4,350102.4,N,18-OCT-22
2019374665,ted.europa.eu/udl?uri=TED:NOTICE:374665-2019:TEXT:EN:HTML,2019,3,05-AUG-19,R209.S3,0,0,N,Dipartimento Stazione Unica Appaltante della Regione Basilicata (SUA-RB) - Ufficio Centrale di Committenza e Soggetto Aggregatore,,Via Vincenzo Verrastro 1,Potenza,85100,A2   ,IT,IT,N,,3,,General public\services,N,N,N,U,ITF5,N,,N,N,33183000,33183,114,33183000,N,1,417,51895250,34681105.2,34681105.2,N,OPE,,0,M,30,Tecnico,70,N,417,10697525,114,,N,N,Eurohospital srl,,"Viale Dell'Unità d'Italia, snc",BARI (BA),70100,IT,N,,Sistema completo di viti e placche,67,,,,,,130000,130000,N,25-JUL-19
2022579517,ted.europa.eu/udl?uri=TED:NOTICE:579517-2022:TEXT:EN:HTML,2022,3,18-OCT-22,R209.S5,0,0,N,Comando Generale dell'Arma dei Carabinieri - Centro Unico Contrattuale,,Viale Romania n. 45,Roma,00197,,IT,,N,,1,,Defence,N,N,N,U,ITI43,N,,N,N,48611000,,4,48611000,Y,,5,965787.09,808069,808069,Y,RES,Y,0,M,30,Technical proposal,70,N,5,15041646,4,,N,N,BUREAU VAN DIJK EDIZIONI ELETTRONICHE S.p.A.,,Via Dante n. 7,Milano,20123,IT,Y,4,Provision of the system for the collection of information from open sources concerning legal persons  – C.I.G. 89961799C1,1,1,,,,500000,495000,495000,N,12-OCT-22
202138649,ted.europa.eu/udl?uri=TED:NOTICE:38649-2021:TEXT:EN:HTML,2021,3,21-JAN-21,R209.S3,0,0,N,ASST di Cremona,01629400191,viale Concordia 1,Cremona,26100,,IT,,N,,8,,Health,N,N,N,U,ITC4A,N,A,N,N,33190000,,22,33141000,N,,148,2716248.72,2716248.72,2716248.72,N,OPE,,0,L,,,,N,149,12475936,22,,N,N,ARIES SRL,,,Mirandola (MO),,IT,Y,,Lotto n. 22: Sacca parenterale EVA per TPN,2,,,,,,9923.4,9923.4,N,31-DEC-20
2019379722,ted.europa.eu/udl?uri=TED:NOTICE:379722-2019:TEXT:EN:HTML,2019,3,07-AUG-19,R209.S3,0,0,N,IN.VA. S.p.A. — Centrale Unica di Committenza Regionale per servizi e forniture,,Loc. L'Île-Blonde 5,Brissogne,11020,A2   ,IT,IT,N,,8,,Other,Y,N,Y,U,ITC20,N,,N,N,33191000,33191,6,33191000,N,4,6,225722,195840,195840,N,OPE,,0,M,30,Offerta tecnica,70,N,6,10706149,6,,N,N,Endotecnica S.r.l.,,Via Valeggio 15,Torino,10128,IT,N,6,CIG 738422680F,3,,,,,14400,12480,12480,N,05-AUG-19
2020163914,ted.europa.eu/udl?uri=TED:NOTICE:163914-2020:TEXT:EN:HTML,2020,3,02-APR-20,R209.S3,0,0,N,Azienda ospedaliero-universitaria «Ospedali riuniti» di Foggia,,via Luigi Pinto 1,Foggia,71122,A2   ,IT,IT,N,,3,,Health,N,N,N,U,ITF46,N,,N,N,33000000,33000,20,33000000,Y,1,25,28689625,16576882.5,16576882.5,N,OPE,,0,L,,,,N,25,11395067,20,,N,N,DIATECH PHARMACOGENETICS SRL A SOCIO UNICO,,,JESI,,IT,Y,20,Fornitura in service di una piattaforma strumentale e kit per analisi molecolari avanzate,1,,,,,,646385,646385,N,
2019495321,ted.europa.eu/udl?uri=TED:NOTICE:495321-2019:TEXT:EN:HTML,2019,6,16-OCT-19,R209.S3,0,0,N,Aeroporti di Roma S.p.A.,,Via Pier Paolo Racchetti 1,Fiumicino,00054,A3   ,IT,IT,N,,4,,Airport-related activities,N,N,N,S,ITI43,N,,N,N,79992000,79992,,79714000,N,3,1,3000000,2302945.36,2302945.36,N,RES,,0,M,30,Pregio tecnico (il dettaglio dei sottocriteri sarà fornito in lettera di invito),70,N,1,10867254,,,N,N,Cosmopol Security S.r.l.,,,Roma,,IT,N,1,Appalto biennale per servizi di controllo in ambito aeroportuale presso l’aeroporto «Leonardo da Vinci» di Fiumicino. — CIG 7507035940,15,,,,,3000000,2302945.36,2302945.36,N,02-OCT-19
2019534707,ted.europa.eu/udl?uri=TED:NOTICE:534707-2019:TEXT:EN:HTML,2019,3,07-NOV-19,R209.S3,0,0,N,ARIA S.p.A. — Azienda Regionale per l'Innovazione degli Acquisti S.p.A.,,Via T. Taramelli 26,Milano,20124,A2   ,IT,IT,N,,6,,General public\services,Y,N,Y,U,"ITC4,ITH3",N,,N,N,39150000,39150,2,39150000,Y,1,20,33768363.6,33768363.6,33768363.6,N,OPE,,0,L,,,,N,20,10941223,2,,N,N,Vernipoll,,,Bevagna,,IT,Y,2,Fornitura di arredi sanitari e carrelli — ARCA_2017_042,2,,,,,3480000,3013680,3013680,N,05-MAR-19
2019480748,ted.europa.eu/udl?uri=TED:NOTICE:480748-2019:TEXT:EN:HTML,2019,3,09-OCT-19,R209.S3,0,0,N,Azienda Socio Sanitaria Territoriale (ASST) Bergamo Est,,Via Paderno 21,Seriate,24068,A2   ,IT,IT,N,,8,,Health,N,N,N,U,,N,,N,,33190000,33190,,,,1,63,6920632.2,6160294.85,6160294.85,,OPE,,0,,,,,N,63,10844892,,,N,N,Cook Italia Srl,,,Nova Milanese (MB),,IT,N,,Lotto n. 62 Set di introduzione,1,,,,1,,27300,27300,N,10-SEP-19
2020430324,ted.europa.eu/udl?uri=TED:NOTICE:430324-2020:TEXT:EN:HTML,2020,3,09-SEP-20,R209.S3,0,0,N,Fondazione Bruno Kessler,,via S. Croce 77,Trento,38122,A2   ,IT,IT,N,,6,,Other,N,N,N,S,ITH20,N,,N,N,66510000,66510,2,66510000,Y,3,7,313458.85,313458.85,313458.85,N,OPE,,0,M,30,qualità,70,N,7,11945573,2,,N,N,Generali Italia SpA,,,Mogliano Veneto,,IT,N,,Polizza elettronica,1,,,,,266623.5,228913.85,228913.85,N,08-SEP-20
2022135244,ted.europa.eu/udl?uri=TED:NOTICE:135244-2022:TEXT:EN:HTML,2022,3,10-MAR-22,R209.S5,0,0,N,"Regione Liguria Stazione Unica Appaltante S.U.A.R. - sede legale Via Fieschi,15 - I - 16121 Genova",00849050109,"Via G. D'Annunzio, 64 - 6° piano",Genova,16121,,IT,,N,,R,,Health,N,N,N,U,ITC3,N,,N,Y,33690000,,57,33690000,N,,451,147892360.89,147892360.89,147892360.89,N,RES,,0,L,,,,N,451,14151871,57,,N,N,ALFASIGMA S.P.A.,,Via Ragazzi del '99 n. 5,Bologna (BO) ,40133,IT,N,57,"LOTTO 57 - B01AB07 - PARNAPARINA - FIALE - 0,3 ML (3.200 U.I.) - FIALA - CIG   8775341879",1,0,,,,12768,12768,12768,N,18-FEB-22
2021143669,ted.europa.eu/udl?uri=TED:NOTICE:143669-2021:TEXT:EN:HTML,2021,3,18-MAR-21,R209.S4,0,0,N,ASL Napoli 2 Nord,,,Frattamaggiore (NA),,,IT,,N,,R,,Health,N,N,N,U,,N,,N,,33000000,,,,,,369,6861869.9,213810.1,213810.1,,OPE,,0,,,,,N,369,12707263,,,N,N,SMITH & NEPHEW SRL,,,Agrate Brianza MB,,IT,N,,Lotto s.T-l.50 CIG 7257083 E54,3,,,,,,850.5,850.5,N,18-JUN-20
2021154484,ted.europa.eu/udl?uri=TED:NOTICE:154484-2021:TEXT:EN:HTML,2021,3,24-MAR-21,R209.S4,0,0,N,AliSa Azienda ligure sanitaria — sede legale piazza della Vittoria 15 — I — 16121 Genova,7456230,via G. D'Annunzio 64 — 6° piano,Genova,16121,,IT,,N,,R,,Health,N,N,N,U,ITC3,N,,N,N,33690000,,1089,33690000,N,,400,157657133.38,157394028.96,157394028.96,N,RES,,0,L,,,,N,400,12732116,1089,,N,N,PFIZER ESTABLISHED MEDICINE ITALY S.R.L.,,,Latina,,IT,N,1089,LOTTO 1325 - N03AX16 - PREGABALIN - CAPSULE - 150 MG - CAPSULA,1,,,,,53318.7,59.24,59.24,N,30-JUN-20
2022438581,ted.europa.eu/udl?uri=TED:NOTICE:438581-2022:TEXT:EN:HTML,2022,6,05-AUG-22,R209.S5,0,0,N,SNAM RETE GAS SPA,,Piazzale Supercortemaggiore 2/4 presso sala posta Snam. S.p.A.,SAN DONATO MILANESE,20097,,IT,,N,,4,,"Production, transport and distribution of gas and heat",N,N,N,S,ITZ,N,,N,N,71323200,,,,Y,,1,5086770,5086770,5086770,N,NIC,,0,M,,Requisito Economico---Requisito Tecnico,30%---70%,N,1,14745453,1,,N,N,TECHINT COMPAGNIA TECNICA INTERNAZIONALE SPA,,VIA MONTE ROSA 93,MILANO,20149,IT,Y,5000004900,Esecuzione dei servizi di ingegneria per impianti GNL. Lotto 1 – Porto Vesme,3,,,,3,6700000,5086770,5086770,Y,14-JUN-22
2022533390,ted.europa.eu/udl?uri=TED:NOTICE:533390-2022:TEXT:EN:HTML,2022,3,27-SEP-22,R209.S5,0,0,N,Dipartimento Stazione Unica Appaltante SUA-RB della Regione Basilicata,,via Vincenzo Verrastro n. 4,Potenza,85100,,IT,,N,,3,,General public\services,Y,N,Y,U,ITF52,N,,N,N,33690000,,4,33690000,Y,,68,258031.69,157989.94,157989.94,N,OPE,,0,L,,,,N,68,14943657,4,,N,N,Demas srl,,,Roma,,IT,N,4,AMOXICILLINA  + ACIDO CLAVULANICO,2,,,,,2700,2196.45,2196.45,N,
2021115300,ted.europa.eu/udl?uri=TED:NOTICE:115300-2021:TEXT:EN:HTML,2021,3,03-MAR-21,R209.S4,0,0,N,Azienda ospedaliera San Camillo Forlanini,,circonvallazione Gianicolense 87,Roma,00152,,IT,,N,,3,,Health,N,N,N,U,ITI43,N,,N,N,33190000,,10,33190000,N,,95,3368599.8,3368598,3368598,N,OPE,,0,M,30,OFFERTA TECNICA,70,N,95,12652461,10,,N,N,S.C.S. International S.r.l.,,,GENOVA,,IT,Y,10,Lotto 10 - Trocar monouso sterile per chirurgia toracica cannula rigida a punta smussa sistema di ancoraggio,4,,,,,15000,9180,9180,N,26-JAN-21
201921800,ted.europa.eu/udl?uri=TED:NOTICE:21800-2019:TEXT:EN:HTML,2019,3,11-JAN-19,R209.S3,0,0,N,ANAS S.p.A.,,Via Monzambano 10,Roma,00185,A2   ,IT,IT,N,,6,,Other,N,N,N,S,ITG12,N,,N,N,63721100,63721,,,N,3,1,13406400,13406400,13406400,N,RES,,0,M,30,Formula Commerciale---Gestione Servizio---Progetto Tecnico---Ulteriori elementi di carattere qualitativo e innovativo,19---21---27---3,N,1,10206441,1,,N,N,Maglione S.r.l.,C.F. e P. IVA 01396720714,Via Padre Ugo Frasca – presso centro DA.MA.,Chieti,66100,IT,Y,DGACQ 60-16,Affidamento in Concessione Servizio OIL — Area di Servizio Caracoli Sud km 29+465 dell’Autostrada A19 «Palermo–Catania»,1,,,,,13406400,13406400,13406400,N,05-DEC-18
2021286774,ted.europa.eu/udl?uri=TED:NOTICE:286774-2021:TEXT:EN:HTML,2021,3,03-JUN-21,R209.S4,0,0,N,Istituto Poligrafico e zecca dello Stato SpA,,via Salaria 691,Roma,00138,,IT,,N,,6,,General public\services,N,N,N,U,ITF46,N,,N,N,24960000,,,24900000,Y,,1,98000,98000,98000,N,NOC,,0,L,,,,N,1,13024202,86713375A9,,N,N,Italchemical Industriale srl,,via Consortile 3 18/20,Ferentino (FR) — Istat 060033,03013,IT,Y,8000009182,"Esercizio dell'opzione, durata 12 mesi, per la fornitura di prodotto chimico tracciante",1,1,,,,,98000,98000,N,17-MAR-21
2018400135,ted.europa.eu/udl?uri=TED:NOTICE:400135-2018:TEXT:EN:HTML,2018,3,11-SEP-18,R208.S4,0,0,,Comune di Benevento – Settore Servizi al cittadino,,Viale dell'università 10,Benevento,82100,A2   ,IT,IT,,,3,,General public\services,N,,,S,,N,,N,,85311000,85311,,,Y,3,,475229.55,475229.55,475229.55,Y,OPE,,0,M,,offerta tecnica---offerta economica,85---15,N,1,8955459,,,N,,Cooperativa Sociale a r.l. «La Solidarietà»,,Via Matarazzo 23,Benevento,82100,IT,,,,1,,,,0,,475229.55,475229.55,N,03-APR-18
201985483,ted.europa.eu/udl?uri=TED:NOTICE:85483-2019:TEXT:EN:HTML,2019,3,21-FEB-19,R209.S3,0,0,N,ESTAR,,,Siena,,A2   ,IT,IT,N,,3,,Health,Y,N,Y,U,ITI1,N,,N,N,33190000,33190,5,33190000,N,1,7,9122000.82,9122000.82,9122000.82,N,OPE,,0,M,30,QUALITA&apos;,70,N,7,10304122,5,,N,N,Abbott Medical Italia S.p.A.,,Centro Direzionale Colleoni — Palazzo Andromeda 20/3,Agrate Brianza,,IT,N,5,OCT — tomografia a coerenza ottica per lo studio dell'albero coronarico — CIG 73319894BA,1,,,,,2643600,2361525,2361525,N,08-FEB-19
2021310004,ted.europa.eu/udl?uri=TED:NOTICE:310004-2021:TEXT:EN:HTML,2021,3,16-JUN-21,R209.S4,0,0,N,"A.Li.Sa. Azienda Ligure Sanitaria — sede legale piazza della Vittoria 15, I, 16121, Genova",7779676,"via G. D'Annunzio 64, 6° piano",Genova,16121,,IT,,N,,R,,Health,Y,N,Y,U,ITC33,N,,N,N,33141600,,9,33141600,N,,18,8523773.45,8523773.45,8523773.45,N,OPE,,0,M,30,qualità,70,N,18,13071487,9,,N,N,B.Braun Milano s.p.a.,,,Milano,,IT,N,9,LOTTO 9 COLOSTOMIA - SISTEMA MONOPEZZO - 9A FONDO CHIUSO PIANA E 9B FONDO CHIUSO CONVESSA,5,,,,,3190240.32,2609721.53,2609721.53,Y,22-APR-21
2022344746,ted.europa.eu/udl?uri=TED:NOTICE:344746-2022:TEXT:EN:HTML,2022,3,22-JUN-22,R209.S5,0,0,N,Comune di San Cesario sul Panaro,,"Piazza Roma, 2",San Cesario sul Panaro,41018,,IT,,N,,3,,General public\services,N,N,N,S,ITH54,N,,N,N,55523100,,,,Y,,1,689676.62,689676.62,689676.62,N,OPE,,0,M,,OFFERTA ECONOMICA---OFFERTA TECNICA,30---70,N,1,14548792,,,N,N,SERENISSIMA RISTORAZIONE S.P.A.,,"Via della Scienza, 26/A",VICENZA,36100,IT,N,,PROCEDURA APERTA PER L’AFFIDAMENTO DEL SERVIZIO DI RISTORAZIONE SCOLASTICA - PERIODO 1^ SETTEMBRE 2021 – 31 AGOSTO 2024,2,,,,,2281872.5,689676.62,689676.62,N,
2018312774,ted.europa.eu/udl?uri=TED:NOTICE:312774-2018:TEXT:EN:HTML,2018,3,16-JUL-18,R209.S3,0,0,N,Agenzia Provinciale per gli Appalti e i Contratti — Servizio Procedure di gara in ambito sanitario di A.P.S.S.,,Via Dogana 8,Trento,38122,A2   ,IT,IT,N,,3,,General public\services,N,N,N,U,,N,,N,,33600000,33600,,,,1,24,102447040.82,73176457.76,73176457.76,,RES,,0,,,,,N,117,8836059,97 - 155 - 161 - 162 - 164 - 649 - 796 - 1088,,N,N,Boehringer Ingelheim Italia S.p.A.,,,Milano,,IT,Y,428-18/06/2018,,128,,,,,,626453.93,626453.93,N,18-JUN-18
2022215149,ted.europa.eu/udl?uri=TED:NOTICE:215149-2022:TEXT:EN:HTML,2022,3,20-APR-22,R209.S5,0,0,N,Azienda Regionale per l'Innovazione e gli Acquisti,,"Via Torquato Taramelli, 26",Milano,20124,,IT,,N,,6,,General public\services,N,N,N,U,ITC4C,Y,,Y,N,33141621,,6,33141621,Y,,7,371165892.56,197618270.33,197618270.33,N,OPE,,0,M,30,tecnico,70,N,7,14297915,6,,N,N,Fater SpA ,,,Pescara ,,IT,N,6,Lotto 6 - Pazienti ricoverati – Pannolini per bambini,1,,,,,534552.03,494399.47,494399.47,N,13-APR-22
2020566523,ted.europa.eu/udl?uri=TED:NOTICE:566523-2020:TEXT:EN:HTML,2020,3,20-NOV-20,R209.S3,0,0,N,"Agenzia regionale per la Prevenzione, l'ambiente e l'energia dell'Emilia Romagna",,via Po 5,Bologna,40139,A2   ,IT,IT,N,,R,,Environment,N,N,N,U,ITH5,Y,,Y,N,24310000,24310,4,24310000,Y,4,4,199100,199100,199100,N,OPE,,0,L,,,,N,4,12226901,4,,N,N,Ultra Scientific Italia srl,,via Carducci 40,Bologna,,IT,Y,4,Procedura aperta telematica per la sottoscrizione di accordi quadro aventi ad oggetto la fornitura di standard da laboratorio,1,1,,,,111792,81400,81400,N,17-SEP-20
2018221274,ted.europa.eu/udl?uri=TED:NOTICE:221274-2018:TEXT:EN:HTML,2018,3,23-MAY-18,R209.S2,0,0,N,Azienda ospedaliera universitaria Federico II,,Via S. Pansini 5,Napoli,80131,A2   ,IT,IT,N,,8,,Health,N,N,N,U,ITF33,N,,N,N,33141121,33141,2,33141121,N,1,9,1338403.6,1338403.6,1338403.6,N,OPE,,0,M,70,qualità,30,N,9,8727758,2,,N,N,Medtronic Italia S.p.A.,,Via Varesina 162,Milano,20156,IT,N,2,Lotto 2 — CIG 6402402544,4,,,,,85329.22,44132.11,44132.11,N,30-MAR-18
2020179727,ted.europa.eu/udl?uri=TED:NOTICE:179727-2020:TEXT:EN:HTML,2020,3,15-APR-20,R209.S3,0,0,N,Azienda ospedaliero universitaria Ospedali Riuniti «Umberto I - G.M.Lancisi - G. Salesi» — S.O. acquisizione beni e servizi,,"via Conca 71, Torrette",Ancona,60126,A2   ,IT,IT,N,,6,,Health,N,N,N,U,ITI32,N,,N,N,33184200,33184,33 - CIG 7540620C77,33181400---33184200,Y,1,45,3660624.43,3660624.43,3660624.43,N,OPE,,0,M,30,Criterio di qualità,70,N,45,11426170,33,,N,N,BARD srl,,,ROMA,,IT,Y,33,"Catet.tunnelliz. c/cuffia, silicone o poliuretano di nuova generaz., singolo e doppio lume, vari calib. e lungh., p.ta chiusa, valvolato; adulo/ped.completo di kit di intr.-b)kit sostit.estens.esterne",1,1,,,,38521.5,24850,24850,N,03-APR-20
2019392464,ted.europa.eu/udl?uri=TED:NOTICE:392464-2019:TEXT:EN:HTML,2019,3,16-AUG-19,R209.S3,0,0,Y,Comando Generale dell’Arma dei Carabinieri – Centro Unico Contrattuale---Comando Generale dell’Arma dei Carabinieri — Centro Unico Contrattuale,,Viale Romania 45---Viale Romania No 45,Roma---Roma,00197---00197,A1   ,IT,IT,N,,1,,Defence,N,N,N,U,IT,N,,N,N,18000000,18000,5,18443310,Y,1,9,1260530,938834.8,938834.8,N,OPE,Y,0,L,,,,N,9,10725469,5,,N,N,LA.BO.CONF. S.r.l.,,Via del Podere di San Giusto No 148,Roma,00166,IT,Y,5,Basque — C.I.G. 7857231822,1,1,,,,104600,102000,102000,N,09-AUG-19
2021624191,ted.europa.eu/udl?uri=TED:NOTICE:624191-2021:TEXT:EN:HTML,2021,3,02-DEC-21,R209.S5,0,0,N,ISTITUTO NAZIONALE PER LO STUDIO E LA CURA DEI TUMORI,,VIA MARIANO SEMMOLA NAPOLI,NAPOLI,80131,,IT,,N,,8,,Health,N,N,N,U,ITF33,N,,N,N,33190000,,8,33190000,N,,9,1309845,1309845,1309845,N,OPE,,0,M,30,qualita,70,N,9,13741882,8,,N,N,VYGON ITALIA S.R.L,,,padova,,IT,N,8,SIRINGA STERILE PRERIEMPITA DI FISIOLOGICA STERILE CIG 8342404191,2,,,,,135000,129000,129000,N,13-OCT-21
2019300082,ted.europa.eu/udl?uri=TED:NOTICE:300082-2019:TEXT:EN:HTML,2019,3,25-JUN-19,R209.S3,0,0,N,Valle Umbra Servizi S.p.A.,,Via A. Busetti 38/40,Spoleto,06049,A3   ,IT,IT,N,,6,,Other,N,N,N,U,ITI21,N,,N,N,34144510,34144,4,42990000,N,1,6,953545,953545,953545,N,OPE,,0,M,30,Servizio di Manutenzione full service” e garanzia estesa---Tempi di consegna---Valutazione Tecnica,10---10---50,N,6,10584176,4,,N,N,Aebi Schmidt Italia S.r.l.,,Via Goethe 7,Merano,39012,IT,Y,4,Fornitura di n. 2 (due) spazzatrici aspiranti da mc 2,3,3,,,,200000,177200,177200,N,29-MAY-19
2020484885,ted.europa.eu/udl?uri=TED:NOTICE:484885-2020:TEXT:EN:HTML,2020,3,09-OCT-20,R209.S3,0,0,N,ASL Roma 1,,,Roma,00193,A2   ,IT,IT,N,,3,,Health,N,N,N,U,ITI43,Y,K,Y,N,33192100,33192,12,33192300,Y,1,16,4392390,3524229.92,3524229.92,N,OPE,,0,M,30,qualità,70,Y,16,12043845,12,,N,N,Givas srl,,,Saonara (PD),,IT,N,8,Arredi sale degenza e ambulatori AO SGA,2,,,,,441078,403829.5,403829.5,N,07-JUL-20
2021577553,ted.europa.eu/udl?uri=TED:NOTICE:577553-2021:TEXT:EN:HTML,2021,3,08-NOV-21,R209.S4,0,0,Y,"A.O.U. ""Maggiore della Carità"" di Novara---ASL BI ",,Corso Mazzini 18,Novara---Biella,28100,,IT,,N,,6,,Health,Y,Y,N,U,"ITC13,ITC15",Y,KA,Y,N,33184200,,17,33184200,Y,,18,14842200,14842200,14842200,N,OPE,,0,M,30,QUALITA&apos;,70,N,49,13646762,17,,N,N,COOK ITALIA SRL,,,NOVA MILANESE,,IT,N,17B,INTRODUTTORI (CALIBRI DA 12F A 14F),3,,,,,130500,84000,84000,N,25-OCT-21
2020195941,ted.europa.eu/udl?uri=TED:NOTICE:195941-2020:TEXT:EN:HTML,2020,3,23-APR-20,R209.S3,0,0,N,Azienda sanitaria unica regionale,,via Oberdan 2,Ancona,60122,A2   ,IT,IT,N,,8,,Health,Y,N,Y,U,ITI3,Y,A,N,N,33651600,33651,22,33651600,Y,1,26,51974379.65,51974379.65,51974379.65,N,RES,,0,L,,,,N,30,11456578,22,,N,N,MSD ITALIA SRL,,Via Vitorchiano n. 151,ROMA,00189,IT,N,25,"VACCINO PAPILLOMAVIRUS UMANO (TIPI UMANI 6, 11, 16, 18, 31, 33, 45, 52, 58) - GARDASIL 9",1,,,,,7469280,7469280,7469280,N,03-MAR-20
202069655,ted.europa.eu/udl?uri=TED:NOTICE:69655-2020:TEXT:EN:HTML,2020,3,07-FEB-20,R209.S3,0,0,Y,A.O.U. Maggiore della carità di Novara---A.S.L. BI---ASL NO---ASL VC---ASL VCO,,Corso Mazzini 18---Via Marconi 23---Viale Roma 7---Corso M. Abbiate 21---Via Mazzini 117,Novara---Biella---Novara---Vercelli---Omegna,28100---13900---28100---13100---28887,A2   ,IT,IT,N,,6,,Health,Y,Y,N,U,"ITC15,ITC12,ITC14,ITC13",Y,KA,Y,N,33141700,33141,41,33141700,Y,1,44,19902381.6,19902381.6,19902381.6,N,OPE,,0,M,30,Qualità,70,N,169,11240595,41,,N,N,INTRAUMA SPA,,,RIVOLI,,IT,Y,41B,Sostituto osseo in fosfato tricalcico,9,,,,,690000,154800,154800,N,21-JAN-20
2021467085,ted.europa.eu/udl?uri=TED:NOTICE:467085-2021:TEXT:EN:HTML,2021,6,10-SEP-21,R209.S4,0,0,N,SOCIETA' METROPOLITANA ACQUE TORINO SPA,,Corso XI Febbraio 14,Torino,10152,,IT,,N,,4,,Water,N,N,N,U,ITC11,N,,N,N,38421100,,16,38421100,Y,,17,9813850,9813850,9813850,N,OPE,,0,M,20,OFFERTA TECNICA,80,N,17,13418446,16,,N,N,WATERTECH S.p.A.,,Passaggio Duomo n. 2,Milano,20123,IT,Y,16,LOTTO 16,2,,,,,75000,71000,71000,N,21-JUL-21
2022714921,ted.europa.eu/udl?uri=TED:NOTICE:714921-2022:TEXT:EN:HTML,2022,3,20-DEC-22,R209.S5,0,0,N,PuntoZero S.c.ar.l. - CRAS - Centrale regionale acquisti in sanità,7052172,"Via Enrico dal Pozzo, snc",Perugia,06126,,IT,,N,,8,,Health,Y,N,Y,U,ITI2,N,,N,N,33140000,,3,33140000,N,,24,9421496,5806276.08,5806276.08,N,OPE,,0,M,20,"Assistenza tecnica e servizio post-vendita---Assortimento---Caratteristiche tecniche qualitative del materiale da osteosintesi, degli impianti e dello strumentario",15---20---45,N,24,15342377,3,,N,N,STRYKER ITALIA SRL SU ,,,ROMA,,IT,N,,SISTEMA PER CHIRURGIA ORTOGNATICA,5,,,,,1014000,508513.6,508513.6,N,
2022701964,ted.europa.eu/udl?uri=TED:NOTICE:701964-2022:TEXT:EN:HTML,2022,3,12-DEC-22,R209.S5,0,0,N,ARES Azienda Regionale della Salute Regione Sardegna,,Via Piero della Francesca 1,Selargius,09047,,IT,,N,,6,,Health,N,N,N,U,ITG2,N,A,Y,N,33196000,,27,33196000,N,,47,30137248.48,30137248.48,30137248.48,N,OPE,,0,L,,,,N,161,15313861,27,,N,N,Hollister Spa,,,Assago,,IT,N,1,Set/Kit postoperatorio sterile per  ileostomia e colostomia ,2,,,,,,14400,14400,N,18-OCT-22
202279352,ted.europa.eu/udl?uri=TED:NOTICE:79352-2022:TEXT:EN:HTML,2022,3,09-FEB-22,R209.S5,0,0,N,Azienda ospedaliero universitaria Sant’Andrea,,via di Grottarossa 1035/1039,Roma,00189,,IT,,N,,3,,Health,N,N,N,U,,N,,N,,33190000,,,,,,134,1001030.4,1001030.4,1001030.4,,OPE,,0,,,,,N,134,14046941,,,N,N,Innovamedica spa,,,MILANO,,IT,Y,,LOTTO 122 CIG 87333425CE,2,,,,,,3435,3435,N,
2021339258,ted.europa.eu/udl?uri=TED:NOTICE:339258-2021:TEXT:EN:HTML,2021,3,01-JUL-21,R209.S4,0,0,N,Consorzio autostrade italiane energia (CAIE),,via Alberto Bergamini 50,Roma,00159,,IT,,N,,8,,Other,N,N,N,U,ITI43,N,,N,N,30163100,,,,N,,1,1200000,1200000,1200000,N,NIC,,0,L,,,,N,1,13125346,,,N,N,Kuwait Petroleum Italia SpA,,viale dell'Oceano indiano 13,Roma,00144,IT,N,,,1,,,,,,1200000,1200000,N,22-JUN-21
202074987,ted.europa.eu/udl?uri=TED:NOTICE:74987-2020:TEXT:EN:HTML,2020,3,13-FEB-20,R209.S3,0,0,N,Istituto nazionale di Fisica Nucleare,,Via E. Fermi 40,Frascati (Roma),00044,A2   ,IT,IT,N,,6,,Other,N,N,N,U,ITC33,N,,N,N,31630000,31630,,,N,1,1,1498995,1498995,1498995,N,NOC,,0,M,20,Offerta tecnica max punti,80,N,1,11249533,,,N,N,ASG Superconductors S.p.A.,,Corso F. M. Perrone 73r,Genova,16152,IT,N,,,1,,,,,1500000,1498995,1498995,N,31-JAN-20
2019416340,ted.europa.eu/udl?uri=TED:NOTICE:416340-2019:TEXT:EN:HTML,2019,6,02-SEP-19,R209.S3,0,0,N,Arriva ITALIA S.r.l.,,Via Trebazio 1,Milano,20145,A3   ,IT,IT,N,,4,,"Urban railway, tramway, trolleybus or bus services",N,N,N,U,,N,,N,,34121000,34121,,,,1,5,4142600,4142600,4142600,,RES,,0,,,,,N,5,10759713,3 - CIG 7921038756,,N,N,Iveco S.p.A.,,Via Puglia 35,Torino (TO),10156,IT,N,,"Acquisto di numero 6 (sei) autobus da adibire al servizio pubblico di linea classe II, con le caratteristiche delineate nei documenti di gara, per le società ASF Autolinee S.r.l. e SAB Autoservizi S.r.l.",1,,,,,1200000,1199400,1199400,N,07-AUG-19
