2021532770,ted.europa.eu/udl?uri=TED:NOTICE:532770-2021:TEXT:EN:HTML,2021,3,15-OCT-21,R209.S4,0,0,N,Ministero della Difesa - Direzione Generale di Commissariato e di Servizi Generali,,"Piazza della Marina, 4 - Ufficio Ricezione Posta di Palazzo Marina",Roma,00196,,IT,,N,,1,,Defence,N,N,N,U,ITZZZ,N,,N,N,15897100,,,,N,,1,1687590,1621410,1621410,N,OPE,,0,L,,,,N,1,13548030,,,N,N,AR FOOD SRL,,,Napoli,,IT,Y,1008,"Gara a procedura aperta per la fornitura di n. 110.300 razioni viveri speciali da combattimento per esigenze delle Forze Armate Italiane (E.I., M.M., A.M., C.C.) E.F. 2021.",1,1,0,0,1,1687590,1621410,1621410,N,15-OCT-21
2019312889,ted.europa.eu/udl?uri=TED:NOTICE:312889-2019:TEXT:EN:HTML,2019,3,02-JUL-19,R209.S3,0,0,N,ATS Sardegna,92005870909,Via Enrico Costa 57,Sassari,09100,A2   ,IT,IT,N,,6,,Health,N,N,N,U,ITG2,N,A,N,N,33141100,33141,A2,33141117,Y,1,13,2329384,637995,637995,N,OPE,,0,L,,,,N,192,10602284,2,,N,N,FARMAC ZABBAN,,,CALDERARA DI RENO,,IT,Y,2,OVATTA DI COTONE IDROFILO 250 g,2,,,,,448,448,448,N,10-MAY-19
2021393624,ted.europa.eu/udl?uri=TED:NOTICE:393624-2021:TEXT:EN:HTML,2021,3,29-JUL-21,R209.S4,0,0,N,PROVINCIA AUTONOMA DI TRENTO - Agenzia Provinciale per gli Appalti e contratti - Servizio appalti – Ufficio gare servizi e forniture,,Via Dogana 8,TRENTO,38122,,IT,,N,,3,,General public\services,Y,N,Y,U,ITH2,N,,N,N,15130000,,3,03311000,Y,,4,824686.62,578922.18,578922.18,N,OPE,,0,M,fino a punti 30,OFFERTA TECNICA fino a punti,70,N,4,13250650,3,,N,N,PESCHERIA DELLAGIACOMA DI DELLAGIACOMA ANDREA & C. S.A.S.,,"via Morizzo, 18",Borgo Valsugana (TN),,IT,Y,3,Fornitura di prodotti ittici,1,,,,,,115565,115565,N,01-JUN-21
202235006,ted.europa.eu/udl?uri=TED:NOTICE:35006-2022:TEXT:EN:HTML,2022,3,17-JAN-22,R209.S5,0,0,N,INVITALIA,,"Via Calabria, 46",Roma,,,IT,,N,,6,,General public\services,N,N,N,S,ITI43,Y,,N,N,79620000,,,,Y,,1,1582937.76,1582937.76,1582937.76,N,OPE,,0,M,20,OFFERTA TECNICA,80,N,1,13945358,,,N,N,RANDSTAD ITALIA SPA,CF 12730090151 P.IVA 10538750968,VIA ROBERTO LEPETIT 8/10 CAP: 20124 MILANO,MILANO,,IT,Y,,,7,,,,,1582937.76,1582937.76,1582937.76,N,22-NOV-21
2022298217,ted.europa.eu/udl?uri=TED:NOTICE:298217-2022:TEXT:EN:HTML,2022,3,01-JUN-22,R209.S5,0,0,N,Sanit&auml;tsbetrieb der Autonomen Provinz Bozen	,,Lorenz-Böhler-Straße 5,Bozen,39100,,IT,,N,,6,,Health,N,N,N,U,ITH10,N,KA,N,N,33141000,,32,33141000,N,,32,1521854.56,1521854.56,1521854.56,N,OPE,,0,M,30,Qualität,70,N,98,14458671,32,,N,N,B.BRAUN MILANO S.P.A.,,,Milano (MI),,IT,N,,Unterstützungsgürtel,5,,,,,30888,13576.66,13576.66,N,29-DEC-21
2021102331,ted.europa.eu/udl?uri=TED:NOTICE:102331-2021:TEXT:EN:HTML,2021,3,24-FEB-21,R209.S4,0,0,N,ALiSa Azienda ligure sanitaria — Sede legale: piazza della Vittoria 15 — I — 16121 Genova,7456230,via G. D'Annunzio 64 — 6° piano,Genova,16121,,IT,,N,,R,,Health,N,N,N,U,ITC3,N,,N,N,33124110,,1,33124110,Y,,2,6774948.73,6774948.73,6774948.73,N,OPE,,0,M,30,qualità,70,N,2,12623052,1,,N,N,Roche Diagnostics SpA,,,Monza,,IT,N,,"Sistemi per Immunoistochimica (IHC), Ibridazione in situ (ISH)",1,,,,,6075824.1,6016796.23,6016796.23,N,24-FEB-21
2021154484,ted.europa.eu/udl?uri=TED:NOTICE:154484-2021:TEXT:EN:HTML,2021,3,24-MAR-21,R209.S4,0,0,N,AliSa Azienda ligure sanitaria — sede legale piazza della Vittoria 15 — I — 16121 Genova,7456230,via G. D'Annunzio 64 — 6° piano,Genova,16121,,IT,,N,,R,,Health,N,N,N,U,ITC3,N,,N,N,33690000,,1051,33690000,N,,400,157657133.38,157394028.96,157394028.96,N,RES,,0,L,,,,N,400,12732078,1051,,N,N,PFIZER SRL,,,Latina,,IT,N,1051,LOTTO 1282 - N03AA02 - FENOBARBITAL - FIALE - 100 MG - FIALA,1,,,,,23713.2,23713.2,23713.2,N,30-JUN-20
2020450041,ted.europa.eu/udl?uri=TED:NOTICE:450041-2020:TEXT:EN:HTML,2020,3,22-SEP-20,R209.S3,0,0,N,"Azienda ospedaliero universitaria Ospedali riuniti Umberto I, Lancisi, Salesi",codice fiscale e partita IVA 01464630423,via Conca 71,Ancona,60126,A2   ,IT,IT,N,,6,,Health,N,N,N,U,,Y,,Y,,33190000,33190,,,,1,110,31954363.83,8639888.82,8639888.82,,OPE,,0,,,,,N,119,11979779,123 - CIG 8016676251,,N,N,CARBINI SRL,,,MONTECAROTTO (AN),,IT,Y,,Fornitura materiali consumabili per VENTILATORE POLMONARE,1,,,,,284240,284240,284240,N,18-JUN-20
2019170130,ted.europa.eu/udl?uri=TED:NOTICE:170130-2019:TEXT:EN:HTML,2019,3,08-APR-19,R209.S3,0,0,N,Azienda Ospedaliero Universitaria Cagliari,,Via Ospedale 54,Cagliari,09124,A2   ,IT,IT,N,,8,,Health,N,N,N,U,ITG27,N,,N,N,33168000,33168,8,33168000,N,1,40,2169450.6,2169450.6,2169450.6,N,OPE,,0,M,30,QUALITA&apos;,70,N,40,10410364,8,,N,N,M.G.Lorenzatto S.r.l,,,Venaria Reale (TO),,IT,Y,8,"Pinza bioptica per prelievo in corso di ecoendoscopia, lunghezza 230 cm circa",1,,,,,22500,16800,16800,N,20-DEC-18
201995077,ted.europa.eu/udl?uri=TED:NOTICE:95077-2019:TEXT:EN:HTML,2019,3,26-FEB-19,R209.S3,0,0,N,A.li.sa. Azienda Ligure Sanitaria — Sede legale Piazza della Vittoria 15 — I-16121 Genova,,Via G. D'Annunzio 64 — 6° piano,Genova,16121,A2   ,IT,IT,N,,R,,Health,Y,N,Y,U,ITC33,N,,N,Y,33690000,33690,32,33690000,N,1,88,54429292.48,54429292.48,54429292.48,N,RES,,0,L,,,,N,88,10316077,32,,N,N,ORPHAN EUROPE (ITALY) SRL,,,MILANO,,IT,N,32,"Lotto n. 34A - L01DA01 - DACTINOMICINA - FIALE - 0,5 MG - ENDOVENOSA",1,,,,,3716.64,3716.64,3716.64,N,20-FEB-19
2019333044,ted.europa.eu/udl?uri=TED:NOTICE:333044-2019:TEXT:EN:HTML,2019,3,11-JUL-19,R209.S3,0,0,N,Provincia Autonoma di Trento — Agenzia provinciale per gli appalti e contratti — Servizio procedure di gara in ambito sanitario di APSS,,Via Dogana 8,Trento,38122,A2   ,IT,IT,N,,3,,General public\services,Y,N,Y,S,ITH2,N,,N,N,66510000,66510,,,N,3,1,468050,468050,468050,N,OPE,,0,M,30,qualità del servizio,70,N,1,10633420,unico,,N,N,Centro Processi Assicurativi S.r.l.,,Via De Marini 53/13,16149 Genova,,IT,Y,,Servizio gestione e liquidazione sinistri RCT/O (loss adjuster) dell'APSS di Trento.,9,,,,,1210000,468050,468050,N,04-JUL-19
201921255,ted.europa.eu/udl?uri=TED:NOTICE:21255-2019:TEXT:EN:HTML,2019,3,14-JAN-19,R209.S3,0,0,N,A.O.U.Policlinico «G. Martino»,,Via Consolare Valeria 1,Messina,98124,A2   ,IT,IT,N,,8,,Health,N,N,N,U,ITG13,N,,N,N,33190000,33190,2,33159000,N,1,13,2118575.8,2118575.8,2118575.8,N,OPE,,0,L,,,,N,13,10205753,2,,N,N,Becton Dickinson ITALIA S.p.A,,,Milano,,IT,N,2,Fornitura quinquennale di kit e reattivi per coltivazione e antibiogramma nei confronti dei micobatteri mediante metodo fluorimetrico.,1,,,,,90000,89890,89890,N,30-JUL-18
2022185885,ted.europa.eu/udl?uri=TED:NOTICE:185885-2022:TEXT:EN:HTML,2022,3,04-APR-22,R209.S5,0,0,N,Unione dei Comuni Terre delle Gravine ,,Via R.Livatino snc,Massafra,74016,,IT,,N,,3,,General public\services,Y,N,Y,S,ITF43,N,,N,N,98350000,,,98350000,N,,1,37420.5,37420.5,37420.5,N,OPE,,0,M,40,offerta tecnica,60,N,1,14240195,,,N,N,I.L.V.C. (IMPIANTI ELETTRICI) S.R.L.,P.IVA: 00085330769,Via Manhes 6,Potenza,65100,IT,Y,,PROCEDURA APERTA PER L’AFFIDAMENTO IN CONCESSIONE DEL SERVIZIO DI GESTIONE LAMPADE VOTIVE CIMITERIALI NEL CIMITERO STORICO E ADEGUAMENTO E MANUTENZIONE RELATIVI IMPIANTI,3,,,,,,37420.5,37420.5,N,
2022639132,ted.europa.eu/udl?uri=TED:NOTICE:639132-2022:TEXT:EN:HTML,2022,3,15-NOV-22,R209.S5,0,0,N,SOCIETA' REGIONALE PER LA SANITA' (SO.RE.SA. S.P.A.),7691971,CENTRO DIREZIONALE ISOLA F9,NAPOLI,80143,,IT,,N,,8,,Health,Y,N,Y,U,ITF3,N,,N,N,33631600,,7,33631600,N,,53,139676330.7,34368930.78,34368930.78,N,OPE,,0,L,,,,N,53,15175608,7,,N,N,CERICHEM BIOPHARM SRL,,,CERIGNOLA,,IT,N,7,Gel idroalcolico semplice 70%  con emollienti/protettivi per prevenire la disidratazione cutanea. flacone in plastica con sigillo anti manomissione e sottotappo riduttore flusso;,2,2,,,,274900.29,253754.11,253754.11,N,09-MAY-22
2019426814,ted.europa.eu/udl?uri=TED:NOTICE:426814-2019:TEXT:EN:HTML,2019,3,06-SEP-19,R209.S3,0,0,N,Provincia di Treviso — Stazione unica appaltante — Area beni e servizi,,Via Cal di Breda 116,Treviso,31100,A2   ,IT,IT,N,,3,,General public\services,N,N,N,S,ITH34,N,,N,N,66600000,66600,14,66600000,Y,3,14,268500,242200,242200,N,OPE,,0,M,30,Criteri qualitativi,70,N,14,10775353,14,,N,N,Intesa Sanpaolo S.p.A.,,Piazza San Carlo 156,Torino,10121,IT,N,14,Comune di Volpago del Montello — CIG: 76205282A5,2,,,,,30000,24750,24750,N,05-APR-19
2022101603,ted.europa.eu/udl?uri=TED:NOTICE:101603-2022:TEXT:EN:HTML,2022,3,21-FEB-22,R209.S5,0,0,N,Azienda Ospedaliero Universitaria Consorziale Policlinico di Bari,,"Piazza Giulio Cesare, 11",BARI,70124,,IT,,N,,3,,Health,N,N,N,U,IT,N,,N,N,33190000,,12,33190000,N,,39,79066226.61,79066226.61,79066226.61,N,OPE,,0,M,30,offerta economicamente piu&apos; vantaggiosa,70,N,39,14088255,12,,N,N, PHARMA-J,,"VIA AUGUSTO RIGHI, N. 17",napoli,,IT,Y,12,"Lenti intraoculari pieghevoli in acrilico idrofobo con filtro UV, monomateriale monopezzo ad asfericità elevata (<= -0.27) con anse a “C”, precaricate con asfericità elevata- CIG  87201363DF",1,,,,1,1386000,1164240,1164240,N,04-FEB-22
201945557,ted.europa.eu/udl?uri=TED:NOTICE:45557-2019:TEXT:EN:HTML,2019,3,28-JAN-19,R209.S3,0,0,N,A.li.sa. Azienda Ligure Sanitaria — Sede legale Piazza della Vittoria 15 — I-16121 Genova,,Via G. D'Annunzio 64 — 6° piano,Genova,16121,A2   ,IT,IT,N,,R,,Health,Y,N,Y,U,ITC3,N,,N,N,33692300,33692,93,33692300,N,1,109,58029696.63,58417619.57,58417619.57,N,OPE,,0,L,,,,N,109,10244895,93,,N,N,Nestlè Italiana S.p.A.,,Via del Mulino n°6,Assago,20090,IT,N,6952086,"Dieta ipercalorica - iperproteica, semi-elementare a base di piccoli peptidi, addizionata in acidi grassi omega-3 EPA e DHA cig. 73386594FC",1,,,,,364000,360100,360100,N,28-JAN-19
2019128118,ted.europa.eu/udl?uri=TED:NOTICE:128118-2019:TEXT:EN:HTML,2019,6,15-MAR-19,R209.S3,0,0,N,Rete Ferroviaria Italiana,,,Roma,00100,A3   ,IT,IT,N,,4,,Railway services,N,N,N,S,IT,Y,K,N,N,50220000,50220,,,Y,1,1,5000000,5000000,5000000,N,NOC,,0,L,,,,N,1,10358766,,,N,N,MESAR S.r.l.,P. IVA: 01776511006,Piazza D'Ara Coeli 1,Roma,,IT,Y,132/2019,,1,,,,1,5000000,5000000,5000000,N,13-MAR-19
2021378649,ted.europa.eu/udl?uri=TED:NOTICE:378649-2021:TEXT:EN:HTML,2021,3,21-JUL-21,R209.S4,0,0,N,Comune di Torraca,,,Torraca,,,IT,,N,,3,,Housing and community amenities,N,N,N,S,IT,N,,N,N,90000000,,,,N,,1,652232,601102.12,601102.12,N,OPE,,0,M,20,offerta tecnica,80,N,1,13215009,,,N,N,Sviluppo risorse ambientali,,,Polla,,IT,N,,Servizio di gestione del ciclo integrato dei rifiuti per anni 03 (tre) nel Comune di Torraca,2,,,,,652232,601102.12,601102.12,N,
201952680,ted.europa.eu/udl?uri=TED:NOTICE:52680-2019:TEXT:EN:HTML,2019,3,01-FEB-19,R209.S3,0,0,N,S.Ec.Am. S.p.A.,,Via Vanoni 79,Sondrio,23100,A2   ,IT,IT,N,,6,,Environment,N,N,N,U,ITC44,N,,N,N,65310000,65310,B,65310000,N,3,2,1371449,1371449,1371449,N,OPE,,0,L,,,,N,2,10259361,B,,N,N,AGSM Energia S.p.A.,,,Verona,,IT,N,2,CIG 762099218D — Fornitura energia utenze bassa tensione,1,,,,,553500,583747,583747,N,30-OCT-18
2020471621,ted.europa.eu/udl?uri=TED:NOTICE:471621-2020:TEXT:EN:HTML,2020,3,02-OCT-20,R209.S3,0,0,N,Azienda ULSS 9 Scaligera,02573090236,via Valverde 42,Verona (VR),37122,A2   ,IT,IT,N,,8,,Health,N,N,N,U,ITH31,N,,N,N,33183100,33183,14,33183100,Y,1,24,625624.85,512807.25,512807.25,N,OPE,,0,M,30/100,Qualità,70/100,N,24,12019412,14,,N,N,CONMED ITALIA SRL,,,PERO MILANO,,IT,N,657/2020,Fornitura di materiale per artroscopia per tre anni,4,,,,,,13500,13500,N,20-AUG-20
202221286,ted.europa.eu/udl?uri=TED:NOTICE:21286-2022:TEXT:EN:HTML,2022,3,11-JAN-22,R209.S5,0,0,N,COMUNE DI FORLI',82810212B6,PIAZZA SAFFI N. 8,FORLI',47121,,IT,,N,,3,,General public\services,N,N,N,S,ITH58,Y,K,Y,N,79952000,,,,N,,1,800000,800000,800000,N,OPE,,0,M,10,offerta tecnica,90,N,1,13910938,,,N,N,Free Event srl Unipersonale,c.f. e p.iva 05644760968,"viale Bianca Maria, 28",Milano,,IT,Y,199,Accordo quadro per affidamento servizio di progettazione e realizzazione eventi nel centro storico di Forlì – festività natalizie quadriennio 2021 - 2025 ,3,3,,,,800000,800000,800000,N,16-DEC-21
2019262104,ted.europa.eu/udl?uri=TED:NOTICE:262104-2019:TEXT:EN:HTML,2019,6,31-MAY-19,R209.S3,0,1,N,S.A.CAL. S.p.A. Società Aeroportuale Calabrese,,c/o Aeroporto Civile,Lamezia Terme,88046,A3   ,IT,IT,N,,4,,Other,N,N,N,S,ITF6,N,,N,N,30199770,30199,,,N,1,1,1310769,1128000,1128000,N,OPE,,0,M,,Il prezzo non è il solo criterio di aggiudicazione e tutti i criteri sono indicati solo nei documenti di gara,1,N,1,10534752,,,N,N,Day Ristoservice S.p.A.,,Via Aeroporto Lamezia Terme,Lamezia Terme,88046,IT,N,,,2,,,,,1310679,1128000,1128000,N,08-MAY-19
2019442911,ted.europa.eu/udl?uri=TED:NOTICE:442911-2019:TEXT:EN:HTML,2019,3,17-SEP-19,R209.S3,0,0,N,Azienda Ospedaliero-Universitaria Città della Salute e della Scienza di Torino,,Corso Bramante 88/90,Torino,10126,A2   ,IT,IT,N,,8,,Health,N,N,N,U,ITC11,N,,N,N,33140000,33140,28,33140000,Y,4,62,206288.85,206288.85,206288.85,N,OPE,,0,M,50,Qualità,50,N,62,10796920,28,,N,N,NEUROMED SPA,,,TORINO,,IT,N,DT N. 22 del 08/01/2019,LOTTO 28 CIG (7023820F9C) COTONINI IN PURO COTONE PER NEUROCHIRURGIA 20x60mm,14,,,,,12200,8580.33,8580.33,N,08-JAN-19
2022464156,ted.europa.eu/udl?uri=TED:NOTICE:464156-2022:TEXT:EN:HTML,2022,3,22-AUG-22,R209.S5,0,0,N,Azienda Ospedaliera San Camillo Forlanini,,"Circonvallazione Gianicolense, 87",Roma,00152,,IT,,N,,3,,Health,N,N,N,U,ITI43,N,,N,N,33124110,,1,33124110,N,,2,245480,245480,245480,N,OPE,,0,M,30/100,70,100,N,2,14794063,1,,N,N,Elettrobiochimica,,,Roma,,IT,Y,,Sistema macchina-reattivi per la determinazione quantitativa del trascritto dei geni di fusione BCR/ABL p210 ,1,,,,,170000,156480,156480,N,01-AUG-22
201882627,ted.europa.eu/udl?uri=TED:NOTICE:82627-2018:TEXT:EN:HTML,2018,3,21-FEB-18,R209.S2,0,0,N,Marche Multiservizi S.p.A.,,Via dei Canonici 144,Pesaro,61122,A3   ,IT,IT,N,,8,,Environment,N,N,N,U,ITI31,N,,N,N,60182000,60182,2,60182000,Y,2,4,1998000,1648767.6,1648767.6,N,OPE,,0,M,50,Caratteristiche tecnico-qualitative---Offerta tempo,40---10,N,4,8566880,2,,N,N,Gorent S.p.A.,,,Scandicci,,IT,Y,2,"Lotto B) n. 2 autocompattatori RSU a carico posteriore, autotelaio a due assi, nuovi, con capacità 15 mSUP 3, per svuotamento di bidoni 120/240/360 l e cassonetti DIN 660/1 100 l — CIG 7008911055",4,,,,,648000,455997.6,455997.6,N,12-JUN-17
2019372202,ted.europa.eu/udl?uri=TED:NOTICE:372202-2019:TEXT:EN:HTML,2019,3,02-AUG-19,R209.S3,0,0,N,Azienda Sanitaria Provinciale di Messina,,Via La Farina 263/n,Messina,90123,A2   ,IT,IT,N,,3,,Health,N,N,N,U,ITG13,Y,,N,N,33185300,33185,119,33185300,N,1,153,46724544.95,46724544.95,46724544.95,N,OPE,,0,L,,,,N,153,10693544,119,,N,N,EUBIOTICA S.A.S.,,VIALE EUROPA ANG. VIA BUCCERI,TORREGROTTA (ME),98040,IT,N,,"Materiale per disintegratore ad ultrasuoni manipoli da 27khz, 35khz, 50khz, per osteotomia, debridment, taglio/coagulo e killing batterico",36,,,,,,14074902,14074902,N,23-MAY-19
2019310319,ted.europa.eu/udl?uri=TED:NOTICE:310319-2019:TEXT:EN:HTML,2019,3,01-JUL-19,R209.S3,0,0,Y,Azienda Ospedaliero Brotzu---Azienda Ospedaliero Universitaria Cagliari---Azienda Ospedaliero Universitaria Sassari---Azienda Tutela Salute Sardegna,,Via Ospedale 54,Cagliari---Cagliari---Sassari---Olbia,09124,A2   ,IT,IT,N,,8,,Health,Y,Y,N,U,ITG2,Y,KC,Y,N,33122000,33122,39,33171000---33662100,N,1,102,49335169.7,49335169.7,49335169.7,N,OPE,,0,M,30,qualità,70,N,102,10598153,39,,N,N,A.B.MED. s.r.l.,,,cagliari,,IT,Y,39,PINZE E FORBICI,4,,,,,1791720,1641520,1641520,N,03-APR-19
2021103161,ted.europa.eu/udl?uri=TED:NOTICE:103161-2021:TEXT:EN:HTML,2021,3,24-FEB-21,R209.S4,0,0,Y,Banca d'Italia---Banco de Espana---Banco de Portugal---Banque de France---Deutsche Bundesbank---European Central Bank---Sveriges Riksbank,,via Nazionale 91,Roma---Madrid---Lisboa---Paris---Frankfurt am Main---Frankfurt am Main---Stockholm,00184,,IT,,Y,IT---ES---PT---FR---DE---DE---SE,8,,Economical anf Financial Affairs,Y,Y,N,S,ITI43,Y,K,N,N,79980000,,,79980000,Y,,1,2803400,2803400,2803400,N,AWP,,1,L,,,,N,1,12625060,,,N,N,Dealogic ltd,,10 Queen Street Place EC4R 1BE,London,,UK,N,,,1,,,,,,2803400,2803400,N,29-JAN-21
2021292213,ted.europa.eu/udl?uri=TED:NOTICE:292213-2021:TEXT:EN:HTML,2021,3,07-JUN-21,R209.S4,0,0,N,Azienda ospedaliero universitaria Cagliari,,via Ospedale 54,Cagliari,09124,,IT,,N,,3,,Health,N,N,N,U,ITG2,N,,N,N,33160000,,8,33160000,N,,18,201915,201915,201915,N,OPE,,0,M,30,Indicati nel capitolato,70,N,18,13035242,8,,N,N,Seda S.p.A,,,MILANO,,IT,Y,8,"Splint nasali esterni non sterili, a forma di trapezio isoscele",1,,,,1,557.28,502.2,502.2,N,10-MAR-21
2021319096,ted.europa.eu/udl?uri=TED:NOTICE:319096-2021:TEXT:EN:HTML,2021,3,22-JUN-21,R209.S4,0,0,N,ESTAR,,via S. Salvi 12,Firenze,50135,,IT,,N,,3,,Health,Y,N,Y,U,ITI14,N,K,N,N,33190000,,29,33190000,N,,69,142815339.2,114160630.4,114160630.4,N,OPE,,0,M,30,Il prezzo non è il solo criterio di aggiudicazione e tutti i criteri sono indicati solo nei documenti di gara,70,N,69,13087150,29,,N,N,B BRAUN MILANO SPA,,,MILANO,,IT,N,29,"Clip singola monouso e sterile, con doppia branca, non riassorbibile in titanio per chirurgia aperta e laparoscopica",1,,,,,124185,116880,116880,N,06-MAY-21
2022601484,ted.europa.eu/udl?uri=TED:NOTICE:601484-2022:TEXT:EN:HTML,2022,3,26-OCT-22,R209.S5,0,0,N,AZIENDA SANITARIA LOCALE NAPOLI 2 NORD,,,Frattamaggiore,80027,,IT,,N,,8,,Health,N,N,N,U,,N,,N,,33140000,,,,,,58,1335271.89,1335271.89,1335271.89,,OPE,,0,,,,,N,58,15084615,,,N,N,MONICO S.P.A.,,,Venezia,,IT,N,,LOTTO 2 - CIG: 9244720847,2,,,,,,4787.1,4787.1,N,04-OCT-22
2019550568,ted.europa.eu/udl?uri=TED:NOTICE:550568-2019:TEXT:EN:HTML,2019,6,18-NOV-19,R209.S3,0,0,N,ACTV S.p.A. — codice AUSA 0000237510,,Isola Nova del Tronchetto 32,Venezia,30135,A3   ,IT,IT,N,,4,,"Urban railway, tramway, trolleybus or bus services",N,N,N,U,ITH35,Y,,Y,N,31682000,31682,2,44320000,N,1,4,774041.35,774041.35,774041.35,N,OPE,,0,L,,,,N,4,10966698,2,,N,N,M.E.B. S.r.l.,,Via Lago di Costanza 1,Schio,,IT,N,1,Accordo quadro per la fornitura di cavi elettrici,2,,,,,,109860.47,109860.47,N,13-NOV-19
2022541436,ted.europa.eu/udl?uri=TED:NOTICE:541436-2022:TEXT:EN:HTML,2022,3,29-SEP-22,R209.S5,0,0,N,Stazione Unica Appaltante della Città Metropolitana di Genova,80007350103,Piazzale G. Mazzini 2,Genova,16122,,IT,,N,,3,,General public\services,N,N,N,S,"IT,ITC33",N,,N,N,90620000,,3,90620000,N,,46,450820,406714,406714,N,OPE,,0,L,,,,N,46,14963590,3,,N,N,MIN DI RAVERA LUIGI E C. S.N.C. ,03221520103 ,via Trento 4/2 ,Campo Ligure,,IT,Y,ID 4537,"SP41 dal km 0+000 (Rossiglione) al km 10+800 (Tiglieto), SP 73 Intero percorso",1,1,,,1,26949,26949,26949,N,21-SEP-22
2019310319,ted.europa.eu/udl?uri=TED:NOTICE:310319-2019:TEXT:EN:HTML,2019,3,01-JUL-19,R209.S3,0,0,Y,Azienda Ospedaliero Brotzu---Azienda Ospedaliero Universitaria Cagliari---Azienda Ospedaliero Universitaria Sassari---Azienda Tutela Salute Sardegna,,Via Ospedale 54,Cagliari---Cagliari---Sassari---Olbia,09124,A2   ,IT,IT,N,,8,,Health,Y,Y,N,U,ITG2,Y,KC,Y,N,33122000,33122,42,33171000---33662100,N,1,102,49335169.7,49335169.7,49335169.7,N,OPE,,0,M,30,qualità,70,N,102,10598156,42,,N,N,A.B.MED. s.r.l.,,,cagliari,,IT,Y,42,"BANDE DI CERCHIAGGIO RETINICO, STERILI MONOUSO, IN SILICONE.",2,,,,,124960,112786,112786,N,03-APR-19
2020116828,ted.europa.eu/udl?uri=TED:NOTICE:116828-2020:TEXT:EN:HTML,2020,3,06-MAR-20,R209.S3,0,0,N,Veritas S.p.A.,,Santa Croce 489,Venezia,30135,A3   ,IT,IT,N,,6,,Environment,N,N,N,S,ITH35,Y,,Y,N,60181000,60181,3,60182000,Y,1,3,4451113.48,4451113.48,4451113.48,N,OPE,,0,L,,,,N,3,11318141,3,,N,N,Gorent,,,Firenze,,IT,Y,3,,1,,,,,,254130,254130,N,25-FEB-20
202297988,ted.europa.eu/udl?uri=TED:NOTICE:97988-2022:TEXT:EN:HTML,2022,3,18-FEB-22,R209.S5,0,0,N,Azienda Ospedaliera San Camillo Forlanini,,"Circonvallazione Gianicolense, 87",Roma,00152,,IT,,N,,3,,Health,N,N,N,U,IT,N,,N,N,33140000,,4,33140000,N,,60,2119510,2119510,2119510,N,OPE,,0,M,30,OFFERTA TECNICA,70,N,60,14082414,4,,N,N,JOHNSON & JOHNSON MEDICAL SPA,,,Pomezia,,IT,N,4,"LOTTO 4 - ELETTROCATETERE ENDOCAVITARIO PER ELETTROFISIOLOGIA, ORIENTABILE BIDIREZIONALE, DECAPOLARE ",2,,,,,12000,11200,11200,N,24-JAN-22
2022716319,ted.europa.eu/udl?uri=TED:NOTICE:716319-2022:TEXT:EN:HTML,2022,3,21-DEC-22,R209.S5,0,0,N,CUC Area Vasta Brescia – Sede distaccata SEBINO BRESCIANO,,via Roma 41,Sale Marasino,25057,,IT,,N,,1,,General public\services,N,N,N,S,ITC47,N,,N,N,66510000,,1,66510000,Y,,6,501000,129739.19,129739.19,N,OPE,,0,M,30,Offerta Tecnica,70,N,6,15345598,1,,N,N,GENERALI ITALIA SPA,,"Via Marocchesa, 14",Mogliano Veneto (TV),31021,IT,Y,,COPERTURA ASSICURATIVA ALL RISKS PROPERTY.,2,,,,,357500,48632.68,48632.68,N,14-DEC-22
2021311184,ted.europa.eu/udl?uri=TED:NOTICE:311184-2021:TEXT:EN:HTML,2021,21,16-JUN-21,R209.S4,0,0,N,Azienda USL Toscana nord ovest,,via Cocchi 7/9,Pisa,56121,,IT,,N,,8,,Health,N,N,N,S,"IT,ITI16",N,,N,,85311200,,,,,,1,3795108.57,3795108.57,3795108.57,N,OPE,,0,,,,,,1,13072671,,,N,,G. Di Vittorio società cooperativa sociale ONLUS,,,Massa,,IT,N,1,Procedura aperta per l'affidamento di servizi presso centro diurno per disabili nel Comune di Livorno — Zona-distretto livornese e concessione dell’immobile,2,,,,,3795108.57,3795108.57,3795108.57,N,09-JUN-21
202153958,ted.europa.eu/udl?uri=TED:NOTICE:53958-2021:TEXT:EN:HTML,2021,6,28-JAN-21,R209.S3,0,0,N,Amiacque srl,,via Rimini 34/36,Milano,20142,,IT,,N,,4,,Water,N,N,N,S,ITC4C,N,,N,N,50530000,,3,50000000,N,,4,1737631.59,1737631.59,1737631.59,N,OPE,,0,M,30,offerta tecnica,70,N,4,12512378,3,,N,N,Emiambiente srl,,,Torino,,IT,Y,3,Manutenzione ordinaria e straordinaria impianti UV presso impianti di depurazione e acquedotto di Amiacque srl,1,,,,,481598.32,372215.32,372215.32,N,27-JAN-21
201925968,ted.europa.eu/udl?uri=TED:NOTICE:25968-2019:TEXT:EN:HTML,2019,3,14-JAN-19,R209.S3,0,1,N,Regione Autonoma della Sardegna — Direzione Regionale della centrale regionale di committenza — Servizio Forniture e servizi,,Viale Trento 69,Cagliari,09100,A2   ,IT,IT,N,,3,,General public\services,Y,N,Y,U,,N,,Y,,33600000,33600,,,,1,399,410342489.39,410342489.39,410342489.39,,OPE,,0,,,,,N,451,10212331,Lotto 59 — B02BD02 FATTORE VIII COAGULAZIONE DA DNA RIC A MOLECOLA INTERA OCTOCOGFLACONE TUTTI I DOS,,N,N,Bayer Spa,,,Milano,,IT,N,,FATTORE VIII COAGULAZIONE DA DNA RIC a molecola intera OCTOCOG,3,,,,,,2299105.08,2299105.08,N,12-JUN-18
2021616862,ted.europa.eu/udl?uri=TED:NOTICE:616862-2021:TEXT:EN:HTML,2021,3,29-NOV-21,R209.S5,0,0,N,ASL ROMA 1,,"VIA ARIOSTO, 3",ROMA,00193,,IT,,N,,3,,Health,N,N,N,U,ITI43,N,,N,N,33110000,,65,33100000,N,,126,3425356.02,3425356.02,3425356.02,N,OPE,,0,M,30/100,QUALITA&apos;,70/100,N,126,13725847,65,,N,N,DAVI MEDICA ,,,ROMA ,,IT,N,65,,4,,,,,,493.5,493.5,N,
2022224700,ted.europa.eu/udl?uri=TED:NOTICE:224700-2022:TEXT:EN:HTML,2022,3,26-APR-22,R209.S5,0,0,N,Comando Generale della Guardia di Finanza - Direzione Approvvigionamenti,,"Viale XXI Aprile, 51",Roma,00162,,IT,,N,,1,,Public Order and Safety,N,N,N,U,ITI43,N,,N,N,48820000,,,50300000,Y,,1,475838.32,475838.32,475838.32,N,RES,,0,L,,,,N,1,14310048,1,,N,N,DIMIRA S.R.L.,,VIA DELLA MAGLIANELLA 65/E,ROMA,00166,IT,N,1551,FORNITURA DI UPGRADE PER APPARATI CISCO IRONPORT,3,,,,,,475838.32,475838.32,Y,12-APR-22
2021533800,ted.europa.eu/udl?uri=TED:NOTICE:533800-2021:TEXT:EN:HTML,2021,3,15-OCT-21,R209.S4,0,0,N,UNIONE DI COMUNI TERRE DI PIANURA,,VIA SAN DONATO 199,GRANAROLO DELL'EMILIA,40057,,IT,,N,,3,,General public\services,N,N,N,S,ITH55,N,,N,N,90670000,,2,90670000,N,,3,864330.01,864330.01,864330.01,N,OPE,,0,M,30,offerta tecnica,70,N,3,13550447,2,,N,N,TECNOAMBIENTE DI BRAIATO GIUSEPPE E MAGAGNINI OBERDAN SNC,,,Castelguglielmo,,IT,Y,8681,"Servizio antilarvale, adulticida e fornitura dei prodotti per la lotta alla zanzara per i Comuni di Budrio e Molinella",3,3,,,,405532.68,400678.45,400678.45,N,01-JUL-21
2022557701,ted.europa.eu/udl?uri=TED:NOTICE:557701-2022:TEXT:EN:HTML,2022,6,06-OCT-22,R209.S5,0,0,N,SNAM RETE GAS SPA,,Piazzale Supercortemaggiore 2/4 presso sala posta Snam. S.p.A.,SAN DONATO MILANESE,20097,,IT,,N,,4,,"Production, transport and distribution of gas and heat",N,N,N,S,ITH,N,,N,N,65210000,,,,Y,,1,611370,611370,611370,N,NIC,,0,L,,,,N,1,14997828,1,,N,N,FORNOVO GAS DISTRIBUZIONE SRL,,VIA PIETRO E MARIA CURIE 14,REGGIO EMILIA,,IT,N,5000004985,"Servizio Alternativo di Fornitura di Gas tramite Carro Bombolaio presso i Punti di Riconsegna allacciati alla rete di trasporto SRG per l’Area 2 (Veneto, Trentino Alto Adige, Friuli, Emilia), 50_4985",4,,,,4,1109450,611370,611370,N,19-AUG-22
2018402322,ted.europa.eu/udl?uri=TED:NOTICE:402322-2018:TEXT:EN:HTML,2018,3,12-SEP-18,R208.S4,0,0,,Città di Torino – Area appalti ed economato — Servizio Affari generali Normative — Forniture e servizi,,Piazza Palazzo di Città 1,Torino,10122,A2   ,IT,IT,,,3,,Other,N,,,S,,N,,N,,55524000,55524,,,N,3,6,79942692.14,79942692.14,79942692.14,N,OPE,,0,M,,offerta tecnica---offerta economica,70---30,N,6,8958176,6,,N,,ATI Eutourist New S.r.l./All food S.p.A.,,Strada Torino 31,Orbassano (TO),10043,IT,,20/2018,Circoscrizione 8,2,,,,,15286234.14,13082208.81,13082208.81,N,08-JUN-18
2022619350,ted.europa.eu/udl?uri=TED:NOTICE:619350-2022:TEXT:EN:HTML,2022,3,04-NOV-22,R209.S5,0,0,N,"Fondazione ""Istituto G.Giglio di Cefalù""",7779194,C.da Pietrapollastra Pisciotto 90015 Cefalù (PA),Cefalù (PA),90015,,IT,,N,,8,,Health,N,N,N,U,ITG1,N,,N,N,33190000,,32,33190000,N,,69,830927,775425,775425,N,OPE,,0,L,,,,N,69,15133109,32,,N,N,SVAS BIOSANA SPA,,,NAPOLI,,IT,N,32,"Procedura di gara ad evidenza europea, ai sensi dell'art. 60 del D.Lgs 50/2016 e ss.mm.ii, per l’affidamento biennale della fornitura di materiale specialistico di radiologia interventistica",1,,,,,,935,935,N,
2019327524,ted.europa.eu/udl?uri=TED:NOTICE:327524-2019:TEXT:EN:HTML,2019,3,09-JUL-19,R209.S3,0,0,N,ASL Napoli 2 Nord,,Via Lupoli 27,Frattamaggiore,80027,A2   ,IT,IT,N,,R,,General public\services,N,N,N,S,ITF33,N,,N,N,85143000,85143,3,85000000,N,3,6,9357296.95,9357296.95,9357296.95,N,OPE,,0,L,,,,N,6,10624089,3,,N,N,Confraternita Misericordia di Caivano,,,Caivano,,IT,Y,,,10,,,,,,1879200,1879200,N,25-JUN-19
